name,description,latitude,longitude,imgPath,phone,website,star,facility,tag,type,address,province,district,subDistrict,province_code,district_code,sub_district_code,score,ratingCount
Hotel Clover Patong Phuket,"Hotel Clover Patong Phuket เป็นตัวเลือกที่ยอดเยี่ยมเมื่อมาเยือนป่าตองที่พักแห่งนี้มอบส่วนผสมที่ลงตัวทั้งความคุ้มค่าและความสะดวกสบาย พร้อมทั้งบรรยากาศทันสมัยรวมถึงสิ่งอำนวยความสะดวกอันหลากหลายที่ได้รับการออกแบบมาเพื่อนักท่องเที่ยวเช่นคุณ Hotel Clover Patong Phuket ตั้งอยู่ใกล้กับสถานที่ท่องเที่ยวสำคัญของป่าตองหลายแห่ง เช่น สนามมวย บางลาป่าตอง (1.5 กม.) และสนามมวยป่าตอง (2.1 กม.) ทำให้ที่พักแห่งนี้เป็นตัวเลือกที่ยอดเยี่ยมสำหรับนักท่องเที่ยว
ห้องพักที่ Hotel Clover Patong Phuket มีเครื่องปรับอากาศ มินิบาร์ และตู้เย็นและแขกจะไม่พลาดการเชื่อมต่อด้วยบริการ Wifi ฟรี
นอกจากนี้ แขกซึ่งเข้าพักที่ Hotel Clover Patong Phuket จะได้รับประโยชน์จากสระว่ายน้ำบนดาดฟ้า เจ้าหน้าที่อำนวยความสะดวก และรูมเซอร์วิสคุณสามารถใช้บริการสระว่ายน้ำ และอาหารเช้าได้ขณะเข้าพักที่ Hotel Clover Patong Phuket หากคุณต้องการที่จอดรถ Hotel Clover Patong Phuket มีที่จอดรถฟรีพร้อมให้บริการ
เมื่อคุณมาถึงแล้ว อย่าลืมแวะไปที่ PiriPiri Flaming Grill หนึ่งในร้านอาหารสเปนในป่าตองซึ่งอยู่ไม่ไกลจาก Hotel Clover Patong Phuket
สิ่งที่ยอดเยี่ยมที่สุดก็คือ Hotel Clover Patong Phuket ทำให้การสำรวจสถานที่ท่องเที่ยวในป่าตอง เช่น Patong Inn Art, Apichart art gallery และ The Phuket Gallery ซึ่งเป็นหนึ่งในหอศิลป์ซึ่งเป็นต่างก็เป็นหอศิลป์ยอดนิยมเป็นเรื่องง่าย
ที่ Hotel Clover Patong Phuket ความสะดวกสบายและความพอใจของคุณมีความสำคัญเป็นอันดับหนึ่ง ที่พักแห่งนี้รอต้อนรับคุณสู่ป่าตอง
",7.895781,98.29673,"['https://media-cdn.tripadvisor.com/media/photo-s/11/de/24/53/surf-hotel-patong.jpg', 'https://media-cdn.tripadvisor.com/media/photo-s/11/de/24/6f/surf-hotel-patong.jpg', 'https://media-cdn.tripadvisor.com/media/photo-s/11/de/24/32/surf-hotel-patong.jpg', 'https://media-cdn.tripadvisor.com/media/photo-s/11/de/23/a2/surf-hotel-patong.jpg', 'https://media-cdn.tripadvisor.com/media/photo-s/11/de/23/86/surf-hotel-patong.jpg', 'https://media-cdn.tripadvisor.com/media/photo-s/11/de/23/04/blu-bar.jpg', 'https://media-cdn.tripadvisor.com/media/photo-s/11/de/23/94/surf-hotel-patong.jpg', 'https://media-cdn.tripadvisor.com/media/photo-s/11/de/23/ac/surf-hotel-patong.jpg', 'https://media-cdn.tripadvisor.com/media/photo-s/11/de/24/b6/surf-hotel-patong.jpg', 'https://media-cdn.tripadvisor.com/media/photo-s/11/73/60/a3/surf-hotel-patong.jpg', 'https://media-cdn.tripadvisor.com/media/photo-s/16/35/8c/44/deluxe-jacuzzi-room.jpg', 'https://media-cdn.tripadvisor.com/media/photo-s/11/99/b6/c4/su.jpg', 'https://media-cdn.tripadvisor.com/media/photo-s/11/de/22/ee/the-shore.jpg', 'https://media-cdn.tripadvisor.com/media/photo-s/11/de/1a/27/surf-hotel-patong.jpg', 'https://media-cdn.tripadvisor.com/media/photo-s/11/99/b2/0c/superior-garden-room.jpg']",,https://th.tripadvisor.com/Hotel_Review-g297930-d13140255-Reviews-Hotel_Clover_Patong_Phuket-Patong_Kathu_Phuket.html,4.0,"['ที่จอดรถฟรี', 'อินเตอร์เน็ตความเร็วสูง (WiFi) ฟรี', 'ฟิตเนสเซนเตอร์พร้อมห้องออกกำลังกาย', 'สระว่ายน้ำ', 'บาร์ / เลานจ์', 'เด็กเข้าพักฟรี', 'บริการรถรับ-ส่งสนามบิน', 'ห้องประชุม', 'ม่านกันแสง', 'เครื่องปรับอากาศ', 'บริการรูมเซอร์วิส', 'ปลอดภัย', 'น้ำบรรจุขวด', 'มินิบาร์', 'ตู้เย็น', 'ทีวีจอแบน']","['ห้องพักปลอดบุหรี่', 'ห้องสวีท']",['โรงแรม'],"162/8-11 ถนนทวีวงศ์ Patong Beach, ป่าตอง, กะทู้, จังหวัดภูเก็ต 83150 ไทย",ภูเก็ต,กะทู้,,83,8302,0,5.0,1447
