name,description,latitude,longitude,imgPath,phone,website,star,facility,tag,type,address,province,district,subDistrict,province_code,district_code,sub_district_code,score,ratingCount
"โรงแรมเดวา ภูเก็ต
Dewa Phuket Resort And Villas","กำลังมองหาที่พักในหาดในยางอยู่ใช่ไหม ลองมาดูโรงแรมเดวา ภูเก็ตรีสอร์ทโรแมนติกที่เป็นประตูสู่สิ่งที่ดีที่สุดของหาดในยาง
มีบริการ Wifi ฟรีสำหรับแขก และห้องพักที่โรงแรมเดวา ภูเก็ตนั้นพร้อมไปด้วยทีวีจอแบน เครื่องปรับอากาศ และตู้เย็น
ระหว่างเข้าพักคุณสามารถใช้ประโยชน์จากบริการและสิ่งอำนวยความสะดวก เช่น เจ้าหน้าที่อำนวยความสะดวก และรูมเซอร์วิส Dewa Phuket Hotel มีสระว่ายน้ำ และอาหารเช้าฟรีภายในสถานที่ให้บริการกับแขกที่เข้าพัก สำหรับนักท่องเที่ยวที่ขับรถมา ที่พักแห่งนี้มีที่จอดรถฟรี
เมื่อคุณมาถึงแล้ว อย่าลืมแวะไปที่ร้านอาหารซีฟู้ดอย่าง Phen's Restaurant Bar & Coffee, ซีอัลมอน ชิล เรสเตอรอง แอนท์ บาร์ และ Wine 99 and Bistro Naiyang Beach Restaurant ซึ่งต่างก็อยู่ไม่ไกลจาก Dewa Phuket Hotel
เราเชื่อว่าคุณจะมีความสุขกับการพักที่โรงแรมเดวา ภูเก็ตขณะที่คุณสัมผัสทุกประสบการณ์อันยอดเยี่ยมของหาดในยาง
",8.092603,98.29968,"['https://media-cdn.tripadvisor.com/media/photo-s/28/ba/e5/7d/garden-pool-villa-exterior.jpg', 'https://media-cdn.tripadvisor.com/media/photo-s/28/ba/d9/3a/dewa-phuket-resort-and.jpg', 'https://media-cdn.tripadvisor.com/media/photo-s/21/8b/70/b0/swimming-pool.jpg', 'https://media-cdn.tripadvisor.com/media/photo-s/28/ba/f3/4b/swimming-pool.jpg', 'https://media-cdn.tripadvisor.com/media/photo-s/28/ba/e5/32/grand-pool-villa-exterior.jpg', 'https://media-cdn.tripadvisor.com/media/photo-s/28/ba/e5/21/grand-pool-villa-exterior.jpg', 'https://media-cdn.tripadvisor.com/media/photo-s/28/ba/e5/1c/grand-pool-villa-interior.jpg', 'https://media-cdn.tripadvisor.com/media/photo-s/28/ba/e5/79/garden-pool-villa-interior.jpg', 'https://media-cdn.tripadvisor.com/media/photo-s/28/ba/e3/04/pool-villa-exterior.jpg', 'https://media-cdn.tripadvisor.com/media/photo-s/11/cb/c9/42/cachet-resort-dewa-phuket.jpg', 'https://media-cdn.tripadvisor.com/media/photo-s/2c/28/06/7a/weddings-on-the-park.jpg', 'https://media-cdn.tripadvisor.com/media/photo-s/2a/7e/ce/a9/dewa-phuket-resort-villas.jpg', 'https://media-cdn.tripadvisor.com/media/photo-s/2a/7e/ce/9c/dewa-phuket-resort-villas.jpg', 'https://media-cdn.tripadvisor.com/media/photo-s/2a/7e/ce/8b/dewa-phuket-resort-villas.jpg', 'https://media-cdn.tripadvisor.com/media/photo-s/2a/7e/ce/79/dewa-phuket-resort-villas.jpg']",+66 76 372 300,https://th.tripadvisor.com/Hotel_Review-g1215773-d1160120-Reviews-Dewa_Phuket_Resort_And_Villas-Nai_Yang_Sakhu_Thalang_District_Phuket.html?spAttributionToken=Mjc1ODgyOTc,4.0,"['ที่จอดรถฟรี', 'อินเตอร์เน็ตความเร็วสูง (WiFi) ฟรี', 'ฟิตเนสเซนเตอร์พร้อมห้องออกกำลังกาย', 'สระว่ายน้ำ', 'บาร์ / เลานจ์', 'ชายหาด', 'บริการให้เช่าจักรยาน', 'บริการดูแลเด็กเล็ก', 'ม่านกันแสง', 'เสื้อคลุมอาบน้ำ', 'เครื่องปรับอากาศ', 'ระเบียงส่วนตัว', 'บริการรูมเซอร์วิส', 'ปลอดภัย', 'ครัวขนาดเล็ก', 'ทีวีจอแบน']","['ห้องพักปลอดบุหรี่', 'ห้องสวีท', 'ห้องสำหรับครอบครัว']",['รีสอร์ท'],"65 Moo 1, Tambon Sakoo, หาดในยาง, สาคู, จังหวัดภูเก็ต 83110 ไทย",ภูเก็ต,ถลาง,,83,8303,0,4.5,1808
"ภูเก็ต แมริออท รีสอร์ท แอนด์ สปา, เมอร์ลิน บีช
Phuket Marriott Resort & Spa, Merlin Beach","หากคุณกำลังมองหารีสอร์ทหรูหราในป่าตองแล้วล่ะก็ ลองมาดูภูเก็ต แมริออท รีสอร์ท แอนด์ สปา, เมอร์ลิน บีชได้เลย
ด้วยทำเลที่อยู่ใกล้กับสถานที่ท่องเที่ยวยอดนิยม เช่น หาดป่าตอง (2.9 กม.) และถนนบางลา (2.9 กม.) แขกของ Merlin Beach Resort Phuket จึงสามารถเยี่ยมชมสถานที่ท่องเที่ยวสำคัญต่างๆ ของป่าตองได้อย่างง่ายดาย
ห้องพักมีทีวีจอแบน เครื่องปรับอากาศ และมินิบาร์ และคุณยังสามารถเชื่อมต่ออินเทอร์เน็ตได้ด้วยบริการ Wifi ฟรี ช่วยให้คุณพักผ่อนพร้อมความสะดวกสบายเต็มที่
Beach Merlin Resort มีรูมเซอร์วิส และเจ้าหน้าที่อำนวยความสะดวกให้บริการ นอกจากนี้ ในฐานะแขกของ Merlin Beach Resort Phuket คุณยังสามารถใช้บริการสระว่ายน้ำ และอาหารเช้าได้อีกด้วย แขกที่เลือกขับรถมาสามารถใช้ที่จอดรถฟรีได้
เมื่อความหิวถามหา อย่าลืมแวะไปที่บ้านริมผา, Sizzle Rooftop Restaurant และ No.6 Restaurant ซึ่งเป็นร้านอาหารซีฟู้ดที่คนในท้องถิ่นและนักท่องเที่ยวต่างชื่นชอบ
บริเวณนี้มีสิ่งให้เที่ยวชมมากมาย ลองดูหอศิลป์ยอดนิยม เช่น Patong Inn Art, Apichart art gallery และ The Phuket Gallery
พนักงานของภูเก็ต แมริออท รีสอร์ท แอนด์ สปา, เมอร์ลิน บีชพร้อมแล้วที่จะให้บริการคุณในทริปต่อไป
",7.884707,98.272835,"['https://media-cdn.tripadvisor.com/media/photo-s/0f/6f/9b/df/tri-trang-beach.jpg', 'https://media-cdn.tripadvisor.com/media/photo-s/0f/4a/86/c7/family-pool.jpg', 'https://media-cdn.tripadvisor.com/media/photo-s/0d/e0/ae/fe/family-pool.jpg', 'https://media-cdn.tripadvisor.com/media/photo-s/15/10/22/ef/balcony-pool-view.jpg', 'https://media-cdn.tripadvisor.com/media/photo-s/15/10/23/8c/kids-club.jpg', 'https://media-cdn.tripadvisor.com/media/photo-s/15/10/23/10/balcony-pool-view.jpg', 'https://media-cdn.tripadvisor.com/media/photo-s/15/10/23/01/pool-terrace.jpg', 'https://media-cdn.tripadvisor.com/media/photo-s/0d/e0/af/6c/merchant-kitchen-all.jpg', 'https://media-cdn.tripadvisor.com/media/photo-s/0f/6f/9d/00/spa-tub.jpg', 'https://media-cdn.tripadvisor.com/media/photo-s/0d/e0/af/45/merchant-kitchen-all.jpg', 'https://media-cdn.tripadvisor.com/media/photo-s/0f/6f/a9/a4/wellness.jpg', 'https://media-cdn.tripadvisor.com/media/photo-s/0d/e0/ae/e6/docg-italian-restaurant.jpg', 'https://media-cdn.tripadvisor.com/media/photo-s/0d/e0/af/42/lobby-bar.jpg', 'https://media-cdn.tripadvisor.com/media/photo-s/0f/6f/9f/97/nam-tok-pool.jpg', 'https://media-cdn.tripadvisor.com/media/photo-s/0f/6f/a0/05/family-pool.jpg']",076 335 300,https://th.tripadvisor.com/Hotel_Review-g297930-d315568-Reviews-Phuket_Marriott_Resort_Spa_Merlin_Beach-Patong_Kathu_Phuket.html,5.0,"['ที่จอดรถฟรี', 'อินเตอร์เน็ตความเร็วสูง (WiFi) ฟรี', 'ฟิตเนสเซนเตอร์พร้อมห้องออกกำลังกาย', 'สระว่ายน้ำ', 'บาร์ / เลานจ์', 'ชายหาด', 'การดำน้ำ', 'เด็กเข้าพักฟรี', 'ห้องพักปลอดสารก่อภูมิแพ้', 'ม่านกันแสง', 'เครื่องปรับอากาศ', 'ชายหาดส่วนตัว', 'ห้องน้ำเพิ่มเติม', 'เครื่องชงกาแฟ / ชา', 'เคเบิลทีวี / ทีวีดาวเทียม', 'โถชำระล้าง']","['วิวมหาสมุทร', 'วิวสระว่ายน้ำ', 'ห้องพักปลอดบุหรี่', 'ห้องสวีท', 'ห้องสำหรับครอบครัว']",['รีสอร์ท'],"99 ถนนหมื่นเงิน หาดไตรตรัง, ป่าตอง, กะทู้, จังหวัดภูเก็ต 83150 ไทย",ภูเก็ต,กะทู้,,83,8302,0,4.5,5840
"เดอะ มารีน่า ภูเก็ต
The Marina Phuket Hotel","การมองหาโรงแรมเหมาะสำหรับครอบครัวที่ใช่ในป่าตองไม่ใช่เรื่องยากอีกต่อไป ยินดีต้อนรับสู่เดอะ มารีน่า ภูเก็ตตัวเลือกที่น่าสนใจสำหรับนักท่องเที่ยวเช่นคุณ
เดอะ มารีน่า ภูเก็ตตั้งอยู่ใกล้กับสถานที่ท่องเที่ยวสำคัญของป่าตองหลายแห่ง เช่น สนามมวย บางลาป่าตอง (0.7 กม.) และมัสยิดป่าตอง (0.8 กม.) ทำให้ที่พักแห่งนี้เป็นตัวเลือกที่ยอดเยี่ยมสำหรับนักท่องเที่ยว
ห้องพักมีสิ่งอำนวยความสะดวก เช่น ทีวีจอแบน เครื่องปรับอากาศ และตู้เย็น และแขกยังสามารถเชื่อมต่ออินเทอร์เน็ตได้ด้วยบริการ Wifi ฟรีของโรงแรมแห่งนี้
โรงแรมแห่งนี้มีแผนกต้อนรับบริการ 24 ชั่วโมง, สระว่ายน้ำบนดาดฟ้า และรูมเซอร์วิส สถานที่ให้บริการแห่งนี้ยังมีบริการสระว่ายน้ำบนดาดฟ้า และอาหารเช้าฟรีช่วยให้การเข้าพักของคุณยอดเยี่ยมขึ้นไปอีก แขกที่นำรถมาสามารถใช้ที่จอดรถฟรีได้
เมื่อความหิวถามหา อย่าลืมแวะไปที่ Rosco's Restaurant & Sports Bar, มูดดี้ส์ คาเฟ่ และ Nicky's Handlebar ซึ่งเป็นร้านอาหารผับที่คนในท้องถิ่นและนักท่องเที่ยวต่างชื่นชอบ
หากคุณอยากสำรวจป่าตองลองดูหนึ่งในหอศิลป์ เช่น Patong Inn Art, Apichart art gallery หรือ The Phuket Gallery
เดอะ มารีน่า ภูเก็ตพร้อมแล้วที่จะต้อนรับคุณสู่ป่าตอง
",7.899594,98.30387,"['https://media-cdn.tripadvisor.com/media/photo-s/12/aa/e7/a4/caption.jpg', 'https://media-cdn.tripadvisor.com/media/photo-s/2d/77/f6/5d/caption.jpg', 'https://media-cdn.tripadvisor.com/media/photo-s/21/50/c2/dc/city-view.jpg', 'https://media-cdn.tripadvisor.com/media/photo-s/2d/77/f5/c1/caption.jpg', 'https://media-cdn.tripadvisor.com/media/photo-s/2d/77/f3/2e/caption.jpg', 'https://media-cdn.tripadvisor.com/media/photo-s/2d/77/f6/31/caption.jpg', 'https://media-cdn.tripadvisor.com/media/photo-s/2d/77/f3/a6/caption.jpg', 'https://media-cdn.tripadvisor.com/media/photo-s/2d/77/f3/3f/caption.jpg', 'https://media-cdn.tripadvisor.com/media/photo-s/2d/77/f2/d6/caption.jpg', 'https://media-cdn.tripadvisor.com/media/photo-s/2d/77/f2/c8/caption.jpg', 'https://media-cdn.tripadvisor.com/media/photo-s/2d/77/f2/aa/caption.jpg', 'https://media-cdn.tripadvisor.com/media/photo-s/2d/77/f2/6f/caption.jpg', 'https://media-cdn.tripadvisor.com/media/photo-s/2d/77/f2/43/caption.jpg', 'https://media-cdn.tripadvisor.com/media/photo-s/2d/77/f2/2e/caption.jpg', 'https://media-cdn.tripadvisor.com/media/photo-s/2d/77/f2/13/caption.jpg']",,https://th.tripadvisor.com/Hotel_Review-g297930-d12725009-Reviews-The_Marina_Phuket_Hotel-Patong_Kathu_Phuket.html,4.0,"['ที่จอดรถฟรี', 'อินเตอร์เน็ตความเร็วสูง (WiFi) ฟรี', 'ฟิตเนสเซนเตอร์พร้อมห้องออกกำลังกาย', 'สระว่ายน้ำ', 'อาหารเช้าฟรี', 'เด็กเข้าพักฟรี', 'สระว่ายน้ำสำหรับเด็ก', 'บริการรถรับ-ส่งสนามบิน', 'ม่านกันแสง', 'ห้องพักแบบเก็บเสียง', 'เครื่องปรับอากาศ', 'โต๊ะทำงาน', 'บริการทำความสะอาด', 'เครื่องชงกาแฟ / ชา', 'เคเบิลทีวี / ทีวีดาวเทียม', 'อ่างอาบน้ำ / ฝักบัวอาบน้ำ']","['วิวภูเขา', 'ห้องพักปลอดบุหรี่', 'ห้องสวีท', 'ห้องสำหรับครอบครัว']",['โรงแรม'],"240/9 Phang Muang Sai Kor Road, ป่าตอง, กะทู้, จังหวัดภูเก็ต 83150 ไทย",ภูเก็ต,กะทู้,,83,8302,0,5.0,4204
Chanalai Romantica Resort,"เมื่อเที่ยวเต็มที่แล้ว ใครๆ ก็ต้องการที่นอนพักให้หายเหนื่อยซักหน่อย สำหรับนักท่องเที่ยวที่มาเยือนหาดกะตะแล้ว Chanalai Romantica Resort เป็นตัวเลือกที่ยอดเยี่ยมสำหรับพักผ่อนและชาร์จพลัง ที่พักแห่งนี้ขึ้นชื่อด้านบรรยากาศโรแมนติก รวมทั้งทำเลที่ยอดเยี่ยมใกล้ร้านอาหารอร่อยๆ Chanalai Romantica Resort ทำให้การสำรวจสิ่งที่ดีที่สุดของหาดกะตะเป็นเรื่องง่าย
ห้องพักมีทีวีจอแบน มินิบาร์ และเครื่องปรับอากาศ และ Tropical Hotel ยังทำให้การเชื่อมต่ออินเทอร์เน็ตเป็นเรื่องง่ายด้วยบริการ Wifi ฟรี
คุณสามารถใช้ประโยชน์จากบริการและสิ่งอำนวยความสะดวกของ Tropical Hotel เช่น แผนกต้อนรับบริการ 24 ชั่วโมง, รูมเซอร์วิส และเจ้าหน้าที่อำนวยความสะดวก นอกจากนี้ แขกยังสามารถเพลิดเพลินไปกับสระว่ายน้ำ และอาหารเช้าฟรีระหว่างการเข้าพัก เพื่อเพิ่มความสะดวกขึ้นไปอีกขั้น ที่พักมีที่จอดรถฟรีสำหรับแขกอีกด้วย
เมื่ออยู่ที่หาดกะตะ คุณควรหาโอกาสแวะไปที่ร้านอาหารใกล้ๆ กับ Tropical Hotel Kata เช่น หม่อมตรีคิทเช่น แอท วิลล่ารอเยล (1.0 กม.), The Boathouse Restaurant (0.5 กม.) และเรดดั๊ก เรสเตอรองท์ (0.7 กม.)
หากคุณกำลังมองหากิจกรรมน่าสนใจ ลองดูสวนชุมชนซึ่งเป็นสวนสาธารณะที่ได้รับความนิยมในหมู่นักท่องเที่ยว
ไม่ว่าคุณจะเดินทางมาทำงาน ท่องเที่ยว หรือทั้งสองอย่าง Chanalai Romantica Resort จะช่วยให้การมาเยือนหาดกะตะของคุณเป็นที่น่าจดจำอย่างแน่นอน
",7.819152,98.3002,"['https://media-cdn.tripadvisor.com/media/photo-s/15/32/66/b0/chanalai-romantica-resort.jpg', 'https://media-cdn.tripadvisor.com/media/photo-s/17/e4/e9/26/chanalai-romantica-resort.jpg', 'https://media-cdn.tripadvisor.com/media/oyster-panos/sources/deluxe-balcony-room-pool-view--v45026.tiles/wide_700.jpg', 'https://media-cdn.tripadvisor.com/media/photo-s/17/e4/e9/20/chanalai-romantica-resort.jpg', 'https://media-cdn.tripadvisor.com/media/photo-s/17/e4/e9/1e/chanalai-romantica-resort.jpg', 'https://media-cdn.tripadvisor.com/media/oyster-panos/sources/pool--v45025.tiles/wide_700.jpg', 'https://media-cdn.tripadvisor.com/media/photo-s/17/e4/e2/c6/chanalai-romantica-resort.jpg', 'https://media-cdn.tripadvisor.com/media/photo-w/17/e4/e2/be/chanalai-romantica-resort.jpg', 'https://media-cdn.tripadvisor.com/media/oyster-panos/sources/star-dust--v45028.tiles/wide_700.jpg', 'https://media-cdn.tripadvisor.com/media/photo-s/17/e4/e2/b6/chanalai-romantica-resort.jpg', 'https://media-cdn.tripadvisor.com/media/photo-s/17/e4/e2/b3/chanalai-romantica-resort.jpg', 'https://media-cdn.tripadvisor.com/media/oyster-panos/sources/lobby--v45029.tiles/wide_700.jpg', 'https://media-cdn.tripadvisor.com/media/photo-s/17/e4/e2/af/chanalai-romantica-resort.jpg', 'https://media-cdn.tripadvisor.com/media/photo-s/17/e4/e2/a3/chanalai-romantica-resort.jpg', 'https://media-cdn.tripadvisor.com/media/photo-s/15/32/66/8a/chanalai-romantica-resort.jpg']",00 66 76 333 105,https://th.tripadvisor.com/Hotel_Review-g1210687-d1379794-Reviews-Chanalai_Romantica_Resort-Kata_Beach_Karon_Phuket.html,4.0,"['ที่จอดรถฟรี', 'อินเตอร์เน็ตความเร็วสูง (WiFi) ฟรี', 'สระว่ายน้ำ', 'อาหารเช้าฟรี', 'บริการรถรับ-ส่งสนามบิน', 'ศูนย์บริการธุรกิจพร้อมบริการอินเทอร์เน็ต', 'การรักษาความปลอดภัยตลอด 24 ชั่วโมง', 'พื้นที่เก็บกระเป๋า', 'เสื้อคลุมอาบน้ำ', 'เครื่องปรับอากาศ', 'บริการทำความสะอาด', 'ระเบียงส่วนตัว', 'บริการรูมเซอร์วิส', 'เครื่องชงกาแฟ / ชา', 'ทีวีจอแบน', 'อ่างอาบน้ำ / ฝักบัวอาบน้ำ']","['วิวมหาสมุทร', 'ห้องพักปลอดบุหรี่']",['โรงแรม'],"62 ถ. กะตะ, หาดกะตะ, กะรน, จังหวัดภูเก็ต 83100 ไทย",ภูเก็ต,เมืองภูเก็ต,,83,8301,0,5.0,1381
