name,description,latitude,longitude,imgPath,phone,website,star,facility,tag,type,address,province,district,subDistrict,province_code,district_code,sub_district_code,score,ratingCount
Metadee Concept Hotel,,7.818861,98.303,"['https://media-cdn.tripadvisor.com/media/photo-s/0e/d0/d5/c5/metadee-resort-and-villas.jpg', 'https://media-cdn.tripadvisor.com/media/photo-s/09/97/e3/fc/metadee-resort-and-villas.jpg', 'https://media-cdn.tripadvisor.com/media/photo-s/2a/ea/15/d3/caption.jpg', 'https://media-cdn.tripadvisor.com/media/photo-s/28/b3/b7/11/metadee-concept-hotel.jpg', 'https://media-cdn.tripadvisor.com/media/photo-s/23/c5/d8/28/metadee-elite-kata-beach.jpg', 'https://media-cdn.tripadvisor.com/media/photo-s/0f/3c/e4/09/metadee-resort-and-villas.jpg', 'https://media-cdn.tripadvisor.com/media/photo-s/0f/07/ae/24/metadee-resort-and-villas.jpg', 'https://media-cdn.tripadvisor.com/media/photo-s/0f/07/ac/f1/metadee-resort-and-villas.jpg', 'https://media-cdn.tripadvisor.com/media/photo-s/09/99/b7/06/metadee-resort-and-villas.jpg', 'https://media-cdn.tripadvisor.com/media/photo-s/2a/ea/16/12/caption.jpg', 'https://media-cdn.tripadvisor.com/media/photo-s/28/b3/b7/36/metadee-concept-hotel.jpg', 'https://media-cdn.tripadvisor.com/media/photo-s/28/b3/b7/35/metadee-concept-hotel.jpg', 'https://media-cdn.tripadvisor.com/media/photo-s/28/b3/b7/34/metadee-concept-hotel.jpg', 'https://media-cdn.tripadvisor.com/media/photo-s/28/b3/b7/33/metadee-concept-hotel.jpg', 'https://media-cdn.tripadvisor.com/media/photo-s/28/b3/b7/31/metadee-concept-hotel.jpg']",,https://th.tripadvisor.com/Hotel_Review-g1210687-d24046777-Reviews-Metadee_Concept_Hotel-Kata_Beach_Karon_Phuket.html,3,"['ที่จอดรถฟรี', 'อินเตอร์เน็ตความเร็วสูง (WiFi) ฟรี', 'ฟิตเนสเซนเตอร์พร้อมห้องออกกำลังกาย', 'สระว่ายน้ำ', 'บาร์ / เลานจ์', 'สโมสรสำหรับเด็ก', 'บริการรถรับส่งฟรีหรือแท็กซี่', 'สปา', 'ม่านกันแสง', 'เสื้อคลุมอาบน้ำ', 'โต๊ะทำงาน', 'บริการทำความสะอาด', 'ระเบียงส่วนตัว', 'บริการรูมเซอร์วิส', 'ปลอดภัย', 'เครื่องใช้สำหรับอาบน้ำฟรี']","['ห้องพักปลอดบุหรี่', 'ห้องสวีท']",['โรงแรม'],"66 Kata Road Muang, หาดกะตะ, กะรน, จังหวัดภูเก็ต 83100 ไทย",ภูเก็ต,เมืองภูเก็ต,,83,8301,0,4.5,1911
เดอะ สเลท,"การมองหารีสอร์ทสุดแหวกแนวที่ใช่ในหาดในยางไม่ใช่เรื่องยากอีกต่อไป ยินดีต้อนรับสู่เดอะ สเลทตัวเลือกที่น่าสนใจสำหรับนักท่องเที่ยวเช่นคุณ
ห้องพักมีทีวีจอแบน มินิบาร์ และเครื่องปรับอากาศ และคุณยังสามารถเชื่อมต่ออินเทอร์เน็ตได้ด้วยบริการ Wifi ฟรี ช่วยให้คุณพักผ่อนพร้อมความสะดวกสบายเต็มที่
Indigo Pearl Resort มีรูมเซอร์วิส และเจ้าหน้าที่อำนวยความสะดวกให้บริการ นอกจากนี้ ในฐานะแขกของ Indigo Pearl Resort คุณยังสามารถใช้บริการสระว่ายน้ำ และอาหารเช้าได้อีกด้วย แขกที่เลือกขับรถมาสามารถใช้ที่จอดรถฟรีได้
เมื่อความหิวถามหา อย่าลืมแวะไปที่ Phen's Restaurant Bar & Coffee, ซีอัลมอน ชิล เรสเตอรอง แอนท์ บาร์ และบิ้ก ฟิชซึ่งเป็นร้านอาหารซีฟู้ดที่คนในท้องถิ่นและนักท่องเที่ยวต่างชื่นชอบ
เดอะ สเลทนำสิ่งที่ดีที่สุดของหาดในยางมาอยู่ใกล้คุณเพียงไม่กี่ก้าว ทำให้การเข้าพักของคุณทั้งผ่อนคลายและสนุกสนานไปพร้อมๆ กัน
",8.086414,98.29903,"['https://media-cdn.tripadvisor.com/media/photo-s/2a/f6/7f/ff/caption.jpg', 'https://media-cdn.tripadvisor.com/media/photo-s/1e/2c/87/c4/the-slate.jpg', 'https://media-cdn.tripadvisor.com/media/oyster-panos/sources/pearl-suite--v96394.tiles/wide_700.jpg', 'https://media-cdn.tripadvisor.com/media/oyster/500/0a/78/b6/cc/pool--v11300713.jpg', 'https://media-cdn.tripadvisor.com/media/photo-s/12/fb/79/5d/tongkah-tin-syndicate.jpg', 'https://media-cdn.tripadvisor.com/media/oyster-panos/sources/pool-suite--v96396.tiles/wide_700.jpg', 'https://media-cdn.tripadvisor.com/media/photo-s/13/03/80/90/beach-side-dinnning-shorething.jpg', 'https://media-cdn.tripadvisor.com/media/photo-s/12/fb/76/bf/rivet.jpg', 'https://media-cdn.tripadvisor.com/media/oyster-panos/sources/pool-suite--v96403.tiles/wide_700.jpg', 'https://media-cdn.tripadvisor.com/media/oyster/500/0a/78/b7/aa/two-bedroom-private-pool-villa--v.jpg', 'https://media-cdn.tripadvisor.com/media/photo-s/09/c3/49/f5/one-bedroom-pearl-shell.jpg', 'https://media-cdn.tripadvisor.com/media/oyster-panos/sources/two-bedroom-private-pool-villa--v96391.tiles/wide_700.jpg', 'https://media-cdn.tripadvisor.com/media/photo-s/09/c3/49/f6/two-bedroom-pearl-shell.jpg', 'https://media-cdn.tripadvisor.com/media/photo-s/09/c3/49/f7/bensley-suite.jpg', 'https://media-cdn.tripadvisor.com/media/oyster-panos/sources/two-bedroom-private-pool-villa--v96392.tiles/wide_700.jpg']",00 66 76 327 006,https://th.tripadvisor.com/Hotel_Review-g1215773-d315573-Reviews-The_Slate_Phuket-Nai_Yang_Sakhu_Thalang_District_Phuket.html,5,"['ที่จอดรถฟรี', 'อินเตอร์เน็ตความเร็วสูง (WiFi) ฟรี', 'ฟิตเนสเซนเตอร์พร้อมห้องออกกำลังกาย', 'สระว่ายน้ำ', 'อาหารเช้าฟรี', 'ชายหาด', 'การยิงธนู', 'บริการดูแลเด็กเล็ก', 'ม่านกันแสง', 'เสื้อคลุมอาบน้ำ', 'เครื่องปรับอากาศ', 'ห้องน้ำเพิ่มเติม', 'โต๊ะทำงาน', 'เครื่องชงกาแฟ / ชา', 'เคเบิลทีวี / ทีวีดาวเทียม', 'ห้องอาบน้ำแบบฝักบัว']","['วิวสระว่ายน้ำ', 'ห้องสวีทสำหรับคู่แต่งงาน', 'ห้องพักปลอดบุหรี่', 'ห้องสวีท', 'ห้องสำหรับครอบครัว']",['รีสอร์ท'],"116 Moo 1 Nai Yang Beach, หาดในยาง, สาคู, จังหวัดภูเก็ต 83110 ไทย",ภูเก็ต,ถลาง,,83,8303,0,4.5,5225
Phuket Emerald Beach Resort,,7.844443,98.294624,"['https://media-cdn.tripadvisor.com/media/photo-s/2d/71/9b/5a/phuket-emerald-beach.jpg', 'https://media-cdn.tripadvisor.com/media/photo-s/2a/22/6d/92/discover-paradise-at.jpg', 'https://media-cdn.tripadvisor.com/media/photo-s/2d/71/b6/92/kid-activity.jpg', 'https://media-cdn.tripadvisor.com/media/photo-s/2d/71/b6/9c/pool-bar.jpg', 'https://media-cdn.tripadvisor.com/media/photo-s/2d/71/b6/97/kid-activity.jpg', 'https://media-cdn.tripadvisor.com/media/photo-s/2d/71/b6/91/kids-club.jpg', 'https://media-cdn.tripadvisor.com/media/photo-s/2d/71/b6/9b/pool-bar.jpg', 'https://media-cdn.tripadvisor.com/media/photo-s/2d/71/b6/96/family.jpg', 'https://media-cdn.tripadvisor.com/media/photo-s/2d/71/b6/90/family-room.jpg', 'https://media-cdn.tripadvisor.com/media/photo-s/2d/71/b6/95/kid-activity.jpg', 'https://media-cdn.tripadvisor.com/media/photo-s/2d/71/b6/9a/fitness.jpg', 'https://media-cdn.tripadvisor.com/media/photo-s/2d/71/b6/94/water-park.jpg', 'https://media-cdn.tripadvisor.com/media/photo-s/2d/71/b6/8f/family-room.jpg', 'https://media-cdn.tripadvisor.com/media/photo-s/2d/71/b6/99/kids-club.jpg', 'https://media-cdn.tripadvisor.com/media/photo-s/2d/71/b6/93/family-room.jpg']",,https://th.tripadvisor.com/Hotel_Review-g10804710-d26394716-Reviews-Phuket_Emerald_Beach_Resort-Karon_Beach_Karon_Phuket.html,4.5,"['ที่จอดรถฟรี', 'อินเตอร์เน็ตความเร็วสูง (WiFi) ฟรี', 'ฟิตเนสเซนเตอร์พร้อมห้องออกกำลังกาย', 'สระว่ายน้ำ', 'บาร์ / เลานจ์', 'บริการดูแลเด็กเล็ก', 'กิจกรรมสำหรับเด็ก (เป็นมิตรกับเด็กและครอบครัว)', 'คอนเซียร์จ', 'เครื่องปรับอากาศ', 'ปลอดภัย', 'มินิบาร์', 'ตู้เย็น', 'อ่างอาบน้ำ / ฝักบัวอาบน้ำ', 'ไดร์เป่าผม']",['ห้องพักปลอดบุหรี่'],['โรงแรม'],"202/19 Karon Road, หาดกะรน, กะรน, จังหวัดภูเก็ต 83100 ไทย",ภูเก็ต,เมืองภูเก็ต,,83,8301,0,4.5,129
โนคู ภูเก็ต,,7.848287,98.32933,"['https://media-cdn.tripadvisor.com/media/photo-s/25/19/3b/99/aerial.jpg', 'https://media-cdn.tripadvisor.com/media/photo-s/25/d5/ff/b1/main-swimming-pool.jpg', 'https://media-cdn.tripadvisor.com/media/photo-s/25/d5/ff/a8/the-terrace.jpg', 'https://media-cdn.tripadvisor.com/media/photo-s/23/86/da/7d/noku-phuket.jpg', 'https://media-cdn.tripadvisor.com/media/photo-s/25/19/3c/07/noku-phuket.jpg', 'https://media-cdn.tripadvisor.com/media/photo-s/23/88/58/f3/hill-villa.jpg', 'https://media-cdn.tripadvisor.com/media/photo-s/2a/00/9f/6b/lemongrass-private-pool.jpg', 'https://media-cdn.tripadvisor.com/media/photo-s/2a/00/9f/66/lemongrass-private-pool.jpg', 'https://media-cdn.tripadvisor.com/media/photo-s/2a/00/9f/a5/lemongrass-private-pool.jpg', 'https://media-cdn.tripadvisor.com/media/photo-s/25/d5/fe/6b/noku-phuket.jpg', 'https://media-cdn.tripadvisor.com/media/photo-s/2a/00/a9/2c/swimming-pool-by-lobby.jpg', 'https://media-cdn.tripadvisor.com/media/photo-s/28/01/17/be/noku-phuket.jpg', 'https://media-cdn.tripadvisor.com/media/photo-s/2c/7a/7e/fa/studio-loft-room.jpg', 'https://media-cdn.tripadvisor.com/media/photo-s/2c/7a/7e/f9/studio-loft-bathtub.jpg', 'https://media-cdn.tripadvisor.com/media/photo-s/2b/e1/27/96/breakfast-noodle-station.jpg']",,https://th.tripadvisor.com/Hotel_Review-g293920-d24070362-Reviews-Noku_Phuket-Phuket.html,5,"['ที่จอดรถฟรี', 'อินเตอร์เน็ตความเร็วสูง (WiFi) ฟรี', 'ฟิตเนสเซนเตอร์พร้อมห้องออกกำลังกาย', 'สระว่ายน้ำ', 'อาหารเช้าฟรี', 'บริการรถรับ-ส่งสนามบิน', 'สปา', 'การรักษาความปลอดภัยตลอด 24 ชั่วโมง', 'เสื้อคลุมอาบน้ำ', 'เครื่องปรับอากาศ', 'บริการทำความสะอาด', 'มีห้องที่มีประตูเชื่อมต่อกัน', 'เครื่องชงกาแฟ / ชา', 'เคเบิลทีวี / ทีวีดาวเทียม', 'โซฟาเบด', 'ห้องอาบน้ำแบบฝักบัว']","['วิวมหาสมุทร', 'วิวสระว่ายน้ำ', 'ห้องพักปลอดบุหรี่', 'ห้องสวีท', 'ห้องสำหรับครอบครัว']",['วิลล่า'],"48/13 Moo 6, Soi Sai-Namyen ใช้เวลาเดินทางโดยรถยนต์ 45 นาทีจากสนามบินนานาชาติภูเก็ต 20 นาทีถึงอ่าวฉลอง ตัวเมืองภูเก็ต และเซ็นทรัลภูเก็ตเฟสติวัล, จังหวัดภูเก็ต 83130 ไทย",ภูเก็ต,เมืองภูเก็ต,,83,8301,0,4.5,46
เดอะ ในหาน,"การมองหารีสอร์ทเหมาะสำหรับครอบครัวที่ใช่ในในหานไม่ใช่เรื่องยากอีกต่อไป ยินดีต้อนรับสู่เดอะ ในหานตัวเลือกที่น่าสนใจสำหรับนักท่องเที่ยวเช่นคุณ
ห้องพักมีทีวีจอแบน มินิบาร์ และตู้เย็น และคุณยังสามารถเชื่อมต่ออินเทอร์เน็ตได้ด้วยบริการ Wifi ฟรี ช่วยให้คุณพักผ่อนพร้อมความสะดวกสบายเต็มที่
The Royal Phuket Yacht Club Hotel มีสระว่ายน้ำบนดาดฟ้า รูมเซอร์วิส และเจ้าหน้าที่อำนวยความสะดวกให้บริการ นอกจากนี้ ในฐานะแขกของเดอะ ในหานคุณยังสามารถใช้บริการสระว่ายน้ำ และบาร์ชั้นดาดฟ้าได้อีกด้วย แขกที่เลือกขับรถมาสามารถใช้ที่จอดรถฟรีได้
หากคุณกำลังมองหาร้านอาหารไทยอร่อยๆ ลองแวะไปที่เดอะ ในหาน - ร็อคซอลท์, Unni's Restaurant หรือ Naiharn Sea Breeze - Lom Talay ขณะพักที่ The Royal Phuket Yacht Club Hotel
มองหาสถานที่ท่องเที่ยวในในหานอยู่ใช่ไหมหาดในหาน (0.3 กม.) เป็นสถานที่ท่องเที่ยวยอดนิยมที่สามารถเดินได้จากเดอะ ในหาน
เดอะ ในหานพร้อมแล้วที่จะต้อนรับคุณสู่ในหาน
",7.778529,98.3032,"['https://media-cdn.tripadvisor.com/media/photo-s/0d/6c/b8/60/grand-ocean-view-room.jpg', 'https://media-cdn.tripadvisor.com/media/photo-s/0d/47/e5/f9/cosmo-at-night.jpg', 'https://media-cdn.tripadvisor.com/media/photo-s/0d/6c/d1/dc/the-spa-at-the-nai-harn.jpg', 'https://media-cdn.tripadvisor.com/media/photo-s/16/de/54/ca/ocean-view.jpg', 'https://media-cdn.tripadvisor.com/media/photo-s/0a/f4/24/38/grand-ocean-view-room.jpg', 'https://media-cdn.tripadvisor.com/media/photo-s/0d/6c/d1/48/the-boutique-shop.jpg', 'https://media-cdn.tripadvisor.com/media/photo-s/0d/6c/d1/28/hotel-entrance.jpg', 'https://media-cdn.tripadvisor.com/media/photo-s/0d/6c/d1/83/swimming-pool.jpg', 'https://media-cdn.tripadvisor.com/media/photo-s/0d/6c/b7/90/ocean-view-suite.jpg', 'https://media-cdn.tripadvisor.com/media/photo-s/0a/13/02/99/cosmo-terrace.jpg', 'https://media-cdn.tripadvisor.com/media/photo-s/0a/f4/24/3a/ocean-view-suite.jpg', 'https://media-cdn.tripadvisor.com/media/photo-s/0a/f4/24/3e/bathroom.jpg', 'https://media-cdn.tripadvisor.com/media/photo-s/09/8a/f6/f0/the-nai-harn-under-renovation.jpg', 'https://media-cdn.tripadvisor.com/media/photo-s/0d/6c/d2/a5/the-spa-at-the-nai-harn.jpg', 'https://media-cdn.tripadvisor.com/media/photo-s/0d/6c/d1/c7/the-spa-at-the-nai-harn.jpg']",,https://th.tripadvisor.com/Hotel_Review-g1231757-d302529-Reviews-The_Nai_Harn-Nai_Harn_Rawai_Phuket.html,5,"['ที่จอดรถฟรี', 'อินเตอร์เน็ตความเร็วสูง (WiFi) ฟรี', 'ฟิตเนสเซนเตอร์พร้อมห้องออกกำลังกาย', 'สระว่ายน้ำ', 'บาร์ / เลานจ์', 'ชายหาด', 'การดำน้ำตื้น', 'บริการดูแลเด็กเล็ก', 'ม่านกันแสง', 'เสื้อคลุมอาบน้ำ', 'เครื่องปรับอากาศ', 'บริการทำความสะอาด', 'ระเบียงส่วนตัว', 'มินิบาร์', 'เคเบิลทีวี / ทีวีดาวเทียม', 'ห้องอาบน้ำแบบฝักบัว']","['วิวภูเขา', 'วิวมหาสมุทร', 'วิวสถานที่สำคัญ', 'วิวสระว่ายน้ำ', 'ห้องสวีทสำหรับคู่แต่งงาน', 'ห้องพักปลอดบุหรี่', 'ห้องสวีท']",['รีสอร์ท'],"23/3 หมู่ 1 ถ. วิเศษ, ในหาน, ราไวย์, จังหวัดภูเก็ต 83100 ไทย",ภูเก็ต,เมืองภูเก็ต,,83,8301,0,4.5,1365
โรงแรมคาซาเดลเอ็ม,"โรงแรมคาซาเดลเอ็มเป็นตัวเลือกอันยอดเยี่ยมสำหรับนักท่องเที่ยวที่มาเยือนป่าตองที่พักแห่งนี้มอบบรรยากาศโรแมนติกพร้อมกับสิ่งอำนวยความสะดวกมากมายเพื่อเพิ่มความพิเศษให้การเข้าพักของคุณ
สถานที่ท่องเที่ยวสำคัญที่อยู่ใกล้เคียง เช่น วัดสุวรรณคีรีวงก์(วัดป่าตอง) (0.5 กม.) และมัสยิดป่าตอง (0.8 กม.) ทำให้โรงแรมคาซาเดลเอ็มเป็นตัวเลือกที่ยอดเยี่ยมเมื่อมาเยือนป่าตอง
ในฐานะ “บ้านหลังที่สองของคุณ” โรงแรมแห่งนี้มีห้องพักพร้อมทีวีจอแบน และการเชื่อมต่ออินเทอร์เน็ตยังทำได้ง่ายๆ ด้วยบริการอินเทอร์เน็ตฟรี
แขกจะได้รับประโยชน์จากแผนกต้อนรับบริการ 24 ชั่วโมง, เจ้าหน้าที่อำนวยความสะดวก และรูมเซอร์วิสขณะเข้าพักที่โรงแรมคาซาเดลเอ็ม นอกจากนี้โรงแรมคาซาเดลเอ็มยังมีสระว่ายน้ำ และบาร์ริมสระว่ายน้ำให้บริการ เพื่อให้การมาเยือนป่าตองของคุณยอดเยี่ยมขึ้นไปอีก นอกจากนี้ ที่พักยังมีที่จอดรถฟรีเพื่อความสะดวกยิ่งขึ้นสำหรับแขก
เมื่อคุณได้โอกาสมาเยือนป่าตอง อย่าลืมแวะชิมปูที่ร้านอาหารใกล้ๆ อย่างบ้านริมผา, ร้านอาหารเบอร์ 6 หรือ No.6 Restaurant
หากคุณกำลังมองหากิจกรรมน่าสนใจ ลองดูหาดป่าตอง (1.6 กม.), ถนนบางลา (1.6 กม.) หรือสนามมวยป่าตอง (0.8 กม.) ซึ่งเป็นสถานที่ท่องเที่ยวที่ได้รับความนิยมในหมู่นักท่องเที่ยว และสามารถเดินไปชมได้
ขอให้คุณมีความสุขกับการมาเยือนป่าตอง!
",7.905006,98.30681,"['https://media-cdn.tripadvisor.com/media/photo-s/2a/94/7b/07/m-sky-restaurant-on-5th.jpg', 'https://media-cdn.tripadvisor.com/media/photo-s/2a/94/7a/b6/room.jpg', 'https://media-cdn.tripadvisor.com/media/oyster-panos/sources/m-deluxe-room--v12445.tiles/wide_700.jpg', 'https://media-cdn.tripadvisor.com/media/photo-s/2a/94/79/4d/deluxe-room.jpg', 'https://media-cdn.tripadvisor.com/media/photo-s/2a/94/7a/47/deluxe-pool-view.jpg', 'https://media-cdn.tripadvisor.com/media/oyster-panos/sources/m-premier-honeymoon-room--v12440.tiles/wide_700.jpg', 'https://media-cdn.tripadvisor.com/media/photo-s/2a/94/79/46/family-room.jpg', 'https://media-cdn.tripadvisor.com/media/photo-s/2a/94/7a/12/twins-deluxe-room.jpg', 'https://media-cdn.tripadvisor.com/media/oyster-panos/sources/m-premier-pool-access-room--v12444.tiles/wide_700.jpg', 'https://media-cdn.tripadvisor.com/media/oyster/500/07/43/b1/45/fitness-center--v4875621.jpg', 'https://media-cdn.tripadvisor.com/media/oyster/500/07/43/b2/45/casa-del-m-restaurant--v4875483.jpg', 'https://media-cdn.tripadvisor.com/media/oyster-panos/sources/m-resort-room--v12438.tiles/wide_700.jpg', 'https://media-cdn.tripadvisor.com/media/photo-s/2a/94/79/1e/swimming-pool.jpg', 'https://media-cdn.tripadvisor.com/media/photo-s/2a/94/77/8f/swimming-pool.jpg', 'https://media-cdn.tripadvisor.com/media/oyster-panos/sources/superior-room--v12441.tiles/wide_700.jpg']",+66 62 974 7959,https://th.tripadvisor.com/Hotel_Review-g297930-d1872337-Reviews-Casa_Del_M_Resort-Patong_Kathu_Phuket.html,4,"['ที่จอดรถฟรี', 'อินเทอร์เน็ตฟรี', 'ฟิตเนสเซนเตอร์พร้อมห้องออกกำลังกาย', 'สระว่ายน้ำ', 'บาร์ / เลานจ์', 'ความบันเทิงยามค่ำคืน', 'ไนท์คลับ / ดีเจ', 'หนังสือ, ดีวีดี, ดนตรีสำหรับเด็ก', 'ม่านกันแสง', 'ห้องพักแบบเก็บเสียง', 'โต๊ะทำงาน', 'พื้นที่รับประทานอาหาร', 'เครื่องชงกาแฟ / ชา', 'เคเบิลทีวี / ทีวีดาวเทียม', 'ผ้าห่มไฟฟ้า', 'อ่างอาบน้ำ / ฝักบัวอาบน้ำ']","['วิวภูเขา', 'วิวสถานที่สำคัญ', 'วิวสระว่ายน้ำ', 'ห้องสวีทสำหรับคู่แต่งงาน']",['โรงแรม'],"14/8 Prabaramee Soi 3, Prabaramee Road, ป่าตอง, กะทู้, จังหวัดภูเก็ต 83150 ไทย",ภูเก็ต,กะทู้,,83,8302,0,4,565
