name,description,latitude,longitude,imgPath,phone,website,star,facility,tag,type,address,province,district,subDistrict,province_code,district_code,sub_district_code,score,ratingCount
บียอนด์ กะรน,,7.829528,98.295,"['https://media-cdn.tripadvisor.com/media/photo-s/2d/04/96/40/caption.jpg', 'https://media-cdn.tripadvisor.com/media/photo-s/2d/04/ea/5a/caption.jpg', 'https://media-cdn.tripadvisor.com/media/photo-s/2d/04/9a/d2/caption.jpg', 'https://media-cdn.tripadvisor.com/media/photo-s/2d/04/96/3d/caption.jpg', 'https://media-cdn.tripadvisor.com/media/photo-s/2d/04/9a/fd/caption.jpg', 'https://media-cdn.tripadvisor.com/media/photo-s/2d/04/ea/5d/caption.jpg', 'https://media-cdn.tripadvisor.com/media/photo-s/24/52/6f/96/beyond-resort-karon.jpg', 'https://media-cdn.tripadvisor.com/media/photo-s/15/8c/0d/cc/beyond-resort-karon.jpg', 'https://media-cdn.tripadvisor.com/media/photo-s/15/a0/7c/b2/pool.jpg', 'https://media-cdn.tripadvisor.com/media/photo-s/15/a1/0b/66/beyond-resort-karon.jpg', 'https://media-cdn.tripadvisor.com/media/photo-s/15/a0/7d/23/beach-restaurant.jpg', 'https://media-cdn.tripadvisor.com/media/photo-s/15/a0/7d/11/beyond-cafe.jpg', 'https://media-cdn.tripadvisor.com/media/photo-s/15/a1/09/4c/beyond-resort-karon.jpg', 'https://media-cdn.tripadvisor.com/media/photo-s/15/a0/7c/c7/beach-bar.jpg', 'https://media-cdn.tripadvisor.com/media/photo-s/15/a0/7c/e5/beyond-cafe.jpg']",+66 76 330 006,https://th.tripadvisor.com/Hotel_Review-g10804710-d535970-Reviews-Beyond_Karon-Karon_Beach_Karon_Phuket.html?spAttributionToken=MjkwMDUxNzA,4,"['ที่จอดรถฟรี', 'อินเทอร์เน็ตฟรี', 'สระว่ายน้ำ', 'บาร์ / เลานจ์', 'ชายหาด', 'การดำน้ำ', 'บริการดูแลเด็กเล็ก', 'บริการรถรับ-ส่งสนามบิน', 'เครื่องปรับอากาศ', 'บริการทำความสะอาด', 'ระเบียงส่วนตัว', 'บริการรูมเซอร์วิส', 'มินิบาร์', 'ตู้เย็น', 'ทีวีจอแบน', 'ไดร์เป่าผม']","['วิวมหาสมุทร', 'ห้องพักปลอดบุหรี่']",['รีสอร์ท'],"51 ถ. กะรน, หาดกะรน, กะรน, จังหวัดภูเก็ต 83100 ไทย",ภูเก็ต,เมืองภูเก็ต,,83,8301,0,4.5,1579
"ภูเก็ต แมริออท รีสอร์ท แอนด์ สปา, เมอร์ลิน บีช","หากคุณกำลังมองหารีสอร์ทหรูหราในป่าตองแล้วล่ะก็ ลองมาดูภูเก็ต แมริออท รีสอร์ท แอนด์ สปา, เมอร์ลิน บีชได้เลย
ด้วยทำเลที่อยู่ใกล้กับสถานที่ท่องเที่ยวยอดนิยม เช่น หาดป่าตอง (2.9 กม.) และถนนบางลา (2.9 กม.) แขกของ Merlin Beach Resort Phuket จึงสามารถเยี่ยมชมสถานที่ท่องเที่ยวสำคัญต่างๆ ของป่าตองได้อย่างง่ายดาย
ห้องพักมีทีวีจอแบน เครื่องปรับอากาศ และมินิบาร์ และคุณยังสามารถเชื่อมต่ออินเทอร์เน็ตได้ด้วยบริการ Wifi ฟรี ช่วยให้คุณพักผ่อนพร้อมความสะดวกสบายเต็มที่
Beach Merlin Resort มีรูมเซอร์วิส และเจ้าหน้าที่อำนวยความสะดวกให้บริการ นอกจากนี้ ในฐานะแขกของ Merlin Beach Resort Phuket คุณยังสามารถใช้บริการสระว่ายน้ำ และอาหารเช้าได้อีกด้วย แขกที่เลือกขับรถมาสามารถใช้ที่จอดรถฟรีได้
เมื่อความหิวถามหา อย่าลืมแวะไปที่บ้านริมผา, Sizzle Rooftop Restaurant และ No.6 Restaurant ซึ่งเป็นร้านอาหารซีฟู้ดที่คนในท้องถิ่นและนักท่องเที่ยวต่างชื่นชอบ
บริเวณนี้มีสิ่งให้เที่ยวชมมากมาย ลองดูหอศิลป์ยอดนิยม เช่น Patong Inn Art, Apichart art gallery และ The Phuket Gallery
พนักงานของภูเก็ต แมริออท รีสอร์ท แอนด์ สปา, เมอร์ลิน บีชพร้อมแล้วที่จะให้บริการคุณในทริปต่อไป
",7.884707,98.272835,"['https://media-cdn.tripadvisor.com/media/photo-s/0f/6f/9b/df/tri-trang-beach.jpg', 'https://media-cdn.tripadvisor.com/media/photo-s/0f/4a/86/c7/family-pool.jpg', 'https://media-cdn.tripadvisor.com/media/photo-s/0d/e0/ae/fe/family-pool.jpg', 'https://media-cdn.tripadvisor.com/media/photo-s/15/10/22/ef/balcony-pool-view.jpg', 'https://media-cdn.tripadvisor.com/media/photo-s/15/10/23/8c/kids-club.jpg', 'https://media-cdn.tripadvisor.com/media/photo-s/15/10/23/10/balcony-pool-view.jpg', 'https://media-cdn.tripadvisor.com/media/photo-s/15/10/23/01/pool-terrace.jpg', 'https://media-cdn.tripadvisor.com/media/photo-s/0d/e0/af/6c/merchant-kitchen-all.jpg', 'https://media-cdn.tripadvisor.com/media/photo-s/0f/6f/9d/00/spa-tub.jpg', 'https://media-cdn.tripadvisor.com/media/photo-s/0d/e0/af/45/merchant-kitchen-all.jpg', 'https://media-cdn.tripadvisor.com/media/photo-s/0f/6f/a9/a4/wellness.jpg', 'https://media-cdn.tripadvisor.com/media/photo-s/0d/e0/ae/e6/docg-italian-restaurant.jpg', 'https://media-cdn.tripadvisor.com/media/photo-s/0d/e0/af/42/lobby-bar.jpg', 'https://media-cdn.tripadvisor.com/media/photo-s/0f/6f/9f/97/nam-tok-pool.jpg', 'https://media-cdn.tripadvisor.com/media/photo-s/0f/6f/a0/05/family-pool.jpg']",00 66 76 335 300,https://th.tripadvisor.com/Hotel_Review-g297930-d315568-Reviews-Phuket_Marriott_Resort_Spa_Merlin_Beach-Patong_Kathu_Phuket.html,5,"['ที่จอดรถฟรี', 'อินเตอร์เน็ตความเร็วสูง (WiFi) ฟรี', 'ฟิตเนสเซนเตอร์พร้อมห้องออกกำลังกาย', 'สระว่ายน้ำ', 'บาร์ / เลานจ์', 'ชายหาด', 'การดำน้ำ', 'เด็กเข้าพักฟรี', 'ห้องพักปลอดสารก่อภูมิแพ้', 'ม่านกันแสง', 'เครื่องปรับอากาศ', 'ชายหาดส่วนตัว', 'ห้องน้ำเพิ่มเติม', 'เครื่องชงกาแฟ / ชา', 'เคเบิลทีวี / ทีวีดาวเทียม', 'โถชำระล้าง']","['วิวมหาสมุทร', 'วิวสระว่ายน้ำ', 'ห้องพักปลอดบุหรี่', 'ห้องสวีท', 'ห้องสำหรับครอบครัว']",['รีสอร์ท'],"99 ถนนหมื่นเงิน หาดไตรตรัง, ป่าตอง, กะทู้, จังหวัดภูเก็ต 83150 ไทย",ภูเก็ต,กะทู้,,83,8302,0,4.5,5918
Hotel Clover Patong Phuket,"Hotel Clover Patong Phuket เป็นตัวเลือกที่ยอดเยี่ยมเมื่อมาเยือนป่าตองที่พักแห่งนี้มอบส่วนผสมที่ลงตัวทั้งความคุ้มค่าและความสะดวกสบาย พร้อมทั้งบรรยากาศทันสมัยรวมถึงสิ่งอำนวยความสะดวกอันหลากหลายที่ได้รับการออกแบบมาเพื่อนักท่องเที่ยวเช่นคุณ Hotel Clover Patong Phuket ตั้งอยู่ใกล้กับสถานที่ท่องเที่ยวสำคัญของป่าตองหลายแห่ง เช่น สนามมวย บางลาป่าตอง (1.5 กม.) และสนามมวยป่าตอง (2.1 กม.) ทำให้ที่พักแห่งนี้เป็นตัวเลือกที่ยอดเยี่ยมสำหรับนักท่องเที่ยว
ห้องพักที่ Hotel Clover Patong Phuket มีเครื่องปรับอากาศ มินิบาร์ และตู้เย็นและแขกจะไม่พลาดการเชื่อมต่อด้วยบริการ Wifi ฟรี
นอกจากนี้ แขกซึ่งเข้าพักที่ Hotel Clover Patong Phuket จะได้รับประโยชน์จากสระว่ายน้ำบนดาดฟ้า เจ้าหน้าที่อำนวยความสะดวก และรูมเซอร์วิสคุณสามารถใช้บริการสระว่ายน้ำ และอาหารเช้าได้ขณะเข้าพักที่ Hotel Clover Patong Phuket หากคุณต้องการที่จอดรถ Hotel Clover Patong Phuket มีที่จอดรถฟรีพร้อมให้บริการ
เมื่อคุณมาถึงแล้ว อย่าลืมแวะไปที่ PiriPiri Flaming Grill หนึ่งในร้านอาหารสเปนในป่าตองซึ่งอยู่ไม่ไกลจาก Hotel Clover Patong Phuket
สิ่งที่ยอดเยี่ยมที่สุดก็คือ Hotel Clover Patong Phuket ทำให้การสำรวจสถานที่ท่องเที่ยวในป่าตอง เช่น Patong Inn Art, Apichart art gallery และ The Phuket Gallery ซึ่งเป็นหนึ่งในหอศิลป์ซึ่งเป็นต่างก็เป็นหอศิลป์ยอดนิยมเป็นเรื่องง่าย
ที่ Hotel Clover Patong Phuket ความสะดวกสบายและความพอใจของคุณมีความสำคัญเป็นอันดับหนึ่ง ที่พักแห่งนี้รอต้อนรับคุณสู่ป่าตอง
",7.895781,98.29673,"['https://media-cdn.tripadvisor.com/media/photo-s/11/de/24/53/surf-hotel-patong.jpg', 'https://media-cdn.tripadvisor.com/media/photo-s/11/de/24/6f/surf-hotel-patong.jpg', 'https://media-cdn.tripadvisor.com/media/photo-s/11/de/24/32/surf-hotel-patong.jpg', 'https://media-cdn.tripadvisor.com/media/photo-s/11/de/23/a2/surf-hotel-patong.jpg', 'https://media-cdn.tripadvisor.com/media/photo-s/11/de/23/86/surf-hotel-patong.jpg', 'https://media-cdn.tripadvisor.com/media/photo-s/11/de/23/04/blu-bar.jpg', 'https://media-cdn.tripadvisor.com/media/photo-s/11/de/23/94/surf-hotel-patong.jpg', 'https://media-cdn.tripadvisor.com/media/photo-s/11/de/23/ac/surf-hotel-patong.jpg', 'https://media-cdn.tripadvisor.com/media/photo-s/11/de/24/b6/surf-hotel-patong.jpg', 'https://media-cdn.tripadvisor.com/media/photo-s/11/73/60/a3/surf-hotel-patong.jpg', 'https://media-cdn.tripadvisor.com/media/photo-s/16/35/8c/44/deluxe-jacuzzi-room.jpg', 'https://media-cdn.tripadvisor.com/media/photo-s/11/99/b6/c4/su.jpg', 'https://media-cdn.tripadvisor.com/media/photo-s/11/de/22/ee/the-shore.jpg', 'https://media-cdn.tripadvisor.com/media/photo-s/11/de/1a/27/surf-hotel-patong.jpg', 'https://media-cdn.tripadvisor.com/media/photo-s/11/99/b2/0c/superior-garden-room.jpg']",,https://th.tripadvisor.com/Hotel_Review-g297930-d13140255-Reviews-Hotel_Clover_Patong_Phuket-Patong_Kathu_Phuket.html,4,"['ที่จอดรถฟรี', 'อินเตอร์เน็ตความเร็วสูง (WiFi) ฟรี', 'ฟิตเนสเซนเตอร์พร้อมห้องออกกำลังกาย', 'สระว่ายน้ำ', 'บาร์ / เลานจ์', 'เด็กเข้าพักฟรี', 'บริการรถรับ-ส่งสนามบิน', 'ห้องประชุม', 'ม่านกันแสง', 'เครื่องปรับอากาศ', 'บริการรูมเซอร์วิส', 'ปลอดภัย', 'น้ำบรรจุขวด', 'มินิบาร์', 'ตู้เย็น', 'ทีวีจอแบน']","['ห้องพักปลอดบุหรี่', 'ห้องสวีท']",['โรงแรม'],"162/8-11 ถนนทวีวงศ์ Patong Beach, ป่าตอง, กะทู้, จังหวัดภูเก็ต 83150 ไทย",ภูเก็ต,กะทู้,,83,8302,0,5,1534
Cassia Phuket,,8.000494,98.29666,"['https://media-cdn.tripadvisor.com/media/photo-s/28/51/dd/29/cassia-phuket-hero-image.jpg', 'https://media-cdn.tripadvisor.com/media/photo-s/09/b0/1e/ee/cassia-phuket.jpg', 'https://media-cdn.tripadvisor.com/media/oyster-panos/sources/one-bedroom-loft--v425961.tiles/wide_700.jpg', 'https://media-cdn.tripadvisor.com/media/photo-s/2a/e8/26/2f/loft-water-view.jpg', 'https://media-cdn.tripadvisor.com/media/photo-s/2a/e8/26/2e/loft.jpg', 'https://media-cdn.tripadvisor.com/media/oyster-panos/sources/one-bedroom-loft--v425976.tiles/wide_700.jpg', 'https://media-cdn.tripadvisor.com/media/photo-s/2a/e8/26/32/guest-room-kitchen.jpg', 'https://media-cdn.tripadvisor.com/media/photo-s/2a/e8/26/33/bathroom.jpg', 'https://media-cdn.tripadvisor.com/media/oyster-panos/sources/one-bedroom-loft--v425978.tiles/wide_700.jpg', 'https://media-cdn.tripadvisor.com/media/photo-s/2a/e8/26/2a/suite.jpg', 'https://media-cdn.tripadvisor.com/media/photo-s/2a/e8/26/2b/suite.jpg', 'https://media-cdn.tripadvisor.com/media/oyster-panos/sources/one-bedroom-loft-water-view--v425963.tiles/wide_700.jpg', 'https://media-cdn.tripadvisor.com/media/photo-s/2a/e8/26/31/loft.jpg', 'https://media-cdn.tripadvisor.com/media/photo-s/2a/e8/26/1a/cassia-main-pool.jpg', 'https://media-cdn.tripadvisor.com/media/oyster-panos/sources/one-bedroom-loft-water-view--v425965.tiles/wide_700.jpg']",+66 76 356 999,https://th.tripadvisor.com/Hotel_Review-g2400063-d8622290-Reviews-Cassia_Phuket-Bang_Tao_Beach_Choeng_Thale_Thalang_District_Phuket.html,5,"['ที่จอดรถฟรี', 'อินเตอร์เน็ตความเร็วสูง (WiFi) ฟรี', 'ฟิตเนสเซนเตอร์พร้อมห้องออกกำลังกาย', 'สระว่ายน้ำ', 'บาร์ / เลานจ์', 'ชายหาด', 'เรือ', 'เด็กเข้าพักฟรี', 'ม่านกันแสง', 'ห้องพักแบบเก็บเสียง', 'เครื่องปรับอากาศ', 'ชายหาดส่วนตัว', 'เครื่องชงกาแฟ / ชา', 'เคเบิลทีวี / ทีวีดาวเทียม', 'โซฟาเบด', 'อ่างอาบน้ำ / ฝักบัวอาบน้ำ']","['วิวภูเขา', 'วิวมหาสมุทร', 'วิวเมือง', 'วิวสระว่ายน้ำ', 'ห้องพักปลอดบุหรี่', 'ห้องสวีท', 'ห้องสำหรับครอบครัว']",['โรงแรม'],"64-64/1 Moo 4, Srisoonthorn Road, หาดบางเทา, เชิงทะเล , จังหวัดภูเก็ต 83110 ไทย",ภูเก็ต,ถลาง,,83,8303,0,4.5,2157
Wekata Luxury,,7.82425,98.29972,"['https://media-cdn.tripadvisor.com/media/photo-s/25/07/27/a6/wekata-luxury.jpg', 'https://media-cdn.tripadvisor.com/media/photo-s/25/07/27/98/wekata-luxury.jpg', 'https://media-cdn.tripadvisor.com/media/photo-s/25/07/27/b8/wekata-luxury.jpg', 'https://media-cdn.tripadvisor.com/media/photo-s/24/a9/9c/ce/wekata-luxury.jpg', 'https://media-cdn.tripadvisor.com/media/photo-s/1c/e9/1c/a9/deluxe-with-panoramic.jpg', 'https://media-cdn.tripadvisor.com/media/photo-s/24/a9/9c/34/wekata-luxury.jpg', 'https://media-cdn.tripadvisor.com/media/photo-s/24/a9/9c/20/wekata-luxury.jpg', 'https://media-cdn.tripadvisor.com/media/photo-s/1d/2e/fb/a7/wekata-luxury.jpg', 'https://media-cdn.tripadvisor.com/media/photo-s/25/07/27/db/wekata-luxury.jpg', 'https://media-cdn.tripadvisor.com/media/photo-s/2c/69/3e/f4/caption.jpg', 'https://media-cdn.tripadvisor.com/media/photo-s/2c/69/3e/f3/caption.jpg', 'https://media-cdn.tripadvisor.com/media/photo-s/2c/69/3e/f2/caption.jpg', 'https://media-cdn.tripadvisor.com/media/photo-s/2c/69/3e/f1/caption.jpg', 'https://media-cdn.tripadvisor.com/media/photo-s/2c/69/3e/f0/caption.jpg', 'https://media-cdn.tripadvisor.com/media/photo-s/2c/69/3e/ef/caption.jpg']",,https://th.tripadvisor.com/Hotel_Review-g1210687-d21280235-Reviews-Wekata_Luxury-Kata_Beach_Karon_Phuket.html,4,"['ที่จอดรถฟรี', 'อินเตอร์เน็ตความเร็วสูง (WiFi) ฟรี', 'ฟิตเนสเซนเตอร์พร้อมห้องออกกำลังกาย', 'สระว่ายน้ำ', 'บาร์ / เลานจ์', 'การดำน้ำตื้น', 'ความบันเทิงยามค่ำคืน', 'บริการรถรับ-ส่งสนามบิน', 'ม่านกันแสง', 'เสื้อคลุมอาบน้ำ', 'เครื่องปรับอากาศ', 'โต๊ะทำงาน', 'พื้นที่รับประทานอาหาร', 'ครัวขนาดเล็ก', 'เคเบิลทีวี / ทีวีดาวเทียม', 'โถชำระล้าง']","['วิวภูเขา', 'วิวเมือง', 'วิวสระว่ายน้ำ', 'ห้องพักปลอดบุหรี่', 'ห้องสวีท', 'ห้องสำหรับครอบครัว', 'มีห้องพักแบบสูบบุหรี่ได้']",['โรงแรม'],"98/196 Kata Road, หาดกะตะ, กะรน, จังหวัดภูเก็ต 83100 ไทย",ภูเก็ต,เมืองภูเก็ต,,83,8301,0,5,465
DoubleTree by Hilton Phuket Banthai Resort,"Banthai Beach Resort & Spa เป็นตัวเลือกอันยอดเยี่ยมสำหรับนักท่องเที่ยวที่มาเยือนป่าตองที่พักแห่งนี้มอบบรรยากาศเหมาะสำหรับครอบครัวพร้อมกับสิ่งอำนวยความสะดวกมากมายเพื่อเพิ่มความพิเศษให้การเข้าพักของคุณ
ระหว่างเข้าพักที่ Banthai Beach Hotel นักท่องเที่ยวสามารถไปเยือนสนามมวย บางลาป่าตอง (0.8 กม.) และมัสยิดป่าตอง (1.8 กม.) ซึ่งต่างก็เป็นสถานที่ท่องเที่ยวยอดนิยมของป่าตอง
Banthai Beach Resort เป็นรีสอร์ทเหมาะสำหรับครอบครัวพร้อมไปด้วยทีวีจอแบน เครื่องปรับอากาศ และมินิบาร์ในห้องพัก และการเชื่อมต่ออินเทอร์เน็ตยังทำได้ง่ายๆ ด้วยบริการอินเทอร์เน็ตฟรี
รีสอร์ทมีแผนกต้อนรับบริการ 24 ชั่วโมง, รูมเซอร์วิส และเจ้าหน้าที่อำนวยความสะดวก นอกจากนี้ แขกยังสามารถเพลิดเพลินไปกับสระว่ายน้ำ และอาหารเช้า ซึ่งทำให้ที่พักแห่งนี้เป็นตัวเลือกยอดนิยมสำหรับนักท่องเที่ยวที่มาเยือนป่าตอง แขกที่มีรถสามารถใช้ที่จอดรถฟรีได้
หากคุณกำลังมองหาร้านอาหารเอเชีย ลองแวะไปที่ร้านบ้านริมผา, No.6 Restaurant หรือ Naughty Nuri's ที่ต่างก็อยู่ไม่ไกลจาก Banthai Beach Resort
สิ่งที่ยอดเยี่ยมที่สุดก็คือ Banthai Beach Hotel ทำให้การสำรวจสถานที่ท่องเที่ยวในป่าตอง เช่น Patong Inn Art, Apichart art gallery และ The Phuket Gallery ซึ่งเป็นหนึ่งในหอศิลป์ซึ่งเป็นต่างก็เป็นหอศิลป์ยอดนิยมเป็นเรื่องง่าย
ขอให้คุณมีความสุขกับการมาเยือนป่าตอง!
",7.890766,98.29474,"['https://media-cdn.tripadvisor.com/media/photo-s/2e/21/0e/df/guest-room-bath.jpg', 'https://media-cdn.tripadvisor.com/media/photo-s/2d/f1/57/f1/guest-room.jpg', 'https://media-cdn.tripadvisor.com/media/photo-s/2d/f1/57/f2/guest-room.jpg', 'https://media-cdn.tripadvisor.com/media/photo-s/2d/f1/57/f3/guest-room.jpg', 'https://media-cdn.tripadvisor.com/media/photo-s/2d/f1/57/ed/guest-room.jpg', 'https://media-cdn.tripadvisor.com/media/photo-s/2d/f1/57/ee/guest-room.jpg', 'https://media-cdn.tripadvisor.com/media/photo-s/2d/f1/57/ef/guest-room-amenity.jpg', 'https://media-cdn.tripadvisor.com/media/photo-s/2d/f1/57/f0/guest-room-bath.jpg', 'https://media-cdn.tripadvisor.com/media/photo-s/2d/e6/5d/66/pool.jpg', 'https://media-cdn.tripadvisor.com/media/photo-s/2d/e5/3b/35/guest-room-amenity.jpg', 'https://media-cdn.tripadvisor.com/media/photo-s/2d/e5/3b/38/guest-room-amenity.jpg', 'https://media-cdn.tripadvisor.com/media/photo-s/2d/e5/3b/39/guest-room-amenity.jpg', 'https://media-cdn.tripadvisor.com/media/photo-s/2d/e5/3b/3a/guest-room-amenity.jpg', 'https://media-cdn.tripadvisor.com/media/photo-s/2d/e5/3b/36/guest-room-amenity.jpg', 'https://media-cdn.tripadvisor.com/media/photo-s/2d/e5/3b/37/guest-room-amenity.jpg']",+66 76 340 850,https://th.tripadvisor.com/Hotel_Review-g297930-d448627-Reviews-DoubleTree_by_Hilton_Phuket_Banthai_Resort-Patong_Kathu_Phuket.html,4,"['ที่จอดรถฟรี', 'Wifi', 'ฟิตเนสเซนเตอร์พร้อมห้องออกกำลังกาย', 'สระว่ายน้ำ', 'บาร์ / เลานจ์', 'ชายหาด', 'การดำน้ำ', 'เด็กเข้าพักฟรี', 'ห้องพักปลอดสารก่อภูมิแพ้', 'ม่านกันแสง', 'เครื่องปรับอากาศ', 'ห้องน้ำเพิ่มเติม', 'เครื่องชงกาแฟ / ชา', 'เคเบิลทีวี / ทีวีดาวเทียม', 'โซฟาเบด', 'โถชำระล้าง']","['วิวสระว่ายน้ำ', 'ห้องพักปลอดบุหรี่', 'ห้องสวีท', 'ห้องสำหรับครอบครัว']",['รีสอร์ท'],"94 Thaveewong Road Patong Beach, ป่าตอง, กะทู้, จังหวัดภูเก็ต 83150 ไทย",ภูเก็ต,กะทู้,,83,8302,0,4.5,4533
