name,description,latitude,longitude,imgPath,phone,website,star,facility,tag,type,address,province,district,subDistrict,province_code,district_code,sub_district_code,score,ratingCount
เดอะ วิจิตร รีสอร์ท,"การมองหาโรงแรมหรูหราที่ใช่ในราไวย์ไม่ใช่เรื่องยากอีกต่อไป ยินดีต้อนรับสู่เดอะ วิจิตร รีสอร์ทตัวเลือกที่น่าสนใจสำหรับนักท่องเที่ยวเช่นคุณ
ห้องพักที่ The Vijitt Resort Phuket Hotel มีทีวีจอแบน เครื่องปรับอากาศ และตู้เย็นและแขกจะไม่พลาดการเชื่อมต่อด้วยบริการ Wifi ฟรี
นอกจากนี้ แขกซึ่งเข้าพักที่ The Vijitt Resort Phuket Hotel จะได้รับประโยชน์จากเจ้าหน้าที่อำนวยความสะดวก และรูมเซอร์วิสคุณสามารถใช้บริการสระว่ายน้ำ และอาหารเช้าฟรีได้ขณะเข้าพักที่ The Vijitt Resort Phuket Hotel หากคุณต้องการที่จอดรถ The Vijitt Resort Phuket Hotel มีที่จอดรถฟรีพร้อมให้บริการ
แหลมพรหมเทพ (4.5 กม.) ตั้งอยู่ใกล้กับเดอะ วิจิตร รีสอร์ททำให้ที่พักแห่งนี้เป็นตัวเลือกที่ยอดเยี่ยมสำหรับนักท่องเที่ยวที่ต้องการไปเยือนสถานที่ท่องเที่ยวยอดนิยมของราไวย์แห่งนี้
",7.792859,98.331985,"['https://media-cdn.tripadvisor.com/media/photo-s/0e/db/a1/4a/the-vijitt-resort-phuket.jpg', 'https://media-cdn.tripadvisor.com/media/photo-w/0e/db/a1/78/the-vijitt-resort-phuket.jpg', 'https://media-cdn.tripadvisor.com/media/oyster/500/06/ac/80/5a/vijitt-pool-villa--v3606815.jpg', 'https://media-cdn.tripadvisor.com/media/photo-s/0e/db/a1/5a/the-vijitt-resort-phuket.jpg', 'https://media-cdn.tripadvisor.com/media/photo-s/07/c1/fa/81/the-vijitt-resort-phuket.jpg', 'https://media-cdn.tripadvisor.com/media/photo-s/0e/db/a1/54/the-vijitt-resort-phuket.jpg', 'https://media-cdn.tripadvisor.com/media/photo-s/0e/db/9f/7a/the-vijitt-resort-phuket.jpg', 'https://media-cdn.tripadvisor.com/media/photo-s/0e/db/a1/46/the-vijitt-resort-phuket.jpg', 'https://media-cdn.tripadvisor.com/media/photo-s/08/68/a7/c8/the-vijitt-resort-phuket.jpg', 'https://media-cdn.tripadvisor.com/media/photo-s/0e/db/a0/c1/the-vijitt-resort-phuket.jpg', 'https://media-cdn.tripadvisor.com/media/photo-s/02/29/97/62/kids-club.jpg', 'https://media-cdn.tripadvisor.com/media/photo-s/01/8e/09/78/the-vijitt-resort-lobby.jpg', 'https://media-cdn.tripadvisor.com/media/photo-s/01/bb/8e/ad/deluxe-villa.jpg', 'https://media-cdn.tripadvisor.com/media/photo-s/0e/db/a0/50/the-vijitt-resort-phuket.jpg', 'https://media-cdn.tripadvisor.com/media/photo-s/07/c1/fa/9b/the-vijitt-resort-phuket.jpg']",,https://th.tripadvisor.com/Hotel_Review-g297934-d1214283-Reviews-The_Vijitt_Resort_Phuket-Rawai_Phuket.html,5,"['ที่จอดรถฟรี', 'อินเตอร์เน็ตความเร็วสูง (WiFi) ฟรี', 'ฟิตเนสเซนเตอร์พร้อมห้องออกกำลังกาย', 'สระว่ายน้ำ', 'อาหารเช้าฟรี', 'ชายหาด', 'แอโรบิก', 'บริการดูแลเด็กเล็ก', 'เสื้อคลุมอาบน้ำ', 'เครื่องปรับอากาศ', 'ชายหาดส่วนตัว', 'ระเบียงส่วนตัว', 'บริการรูมเซอร์วิส', 'มินิบาร์', 'ตู้เย็น', 'ทีวีจอแบน']","['วิวมหาสมุทร', 'ห้องพักปลอดบุหรี่']",['โรงแรม'],"16 หมู่ 2 ถ. วิเศษ, ราไวย์, จังหวัดภูเก็ต 83130 ไทย",ภูเก็ต,เมืองภูเก็ต,,83,8301,0,4.5,1780
ดีวานา พลาซ่า ภูเก็ต ป่าตอง,"ดีวานา พลาซ่า ภูเก็ต ป่าตองเป็นตัวเลือกที่ยอดเยี่ยมเมื่อมาเยือนป่าตองที่พักแห่งนี้มอบส่วนผสมที่ลงตัวทั้งความคุ้มค่าและความสะดวกสบายพร้อมทั้งบรรยากาศเหมาะสำหรับครอบครัว รวมถึงสิ่งอำนวยความสะดวกอันหลากหลายที่ได้รับการออกแบบมาเพื่อนักท่องเที่ยวเช่นคุณ
ในฐานะ “บ้านหลังที่สองของคุณ” โรงแรมแห่งนี้มีห้องพักพร้อมทีวีจอแบน เครื่องปรับอากาศ และตู้เย็น และการเชื่อมต่ออินเทอร์เน็ตยังทำได้ง่ายๆ ด้วยบริการ Wifi ฟรี
แขกจะได้รับประโยชน์จากเจ้าหน้าที่อำนวยความสะดวก รูมเซอร์วิส และสระว่ายน้ำบนดาดฟ้าขณะเข้าพักที่ Mercure Patong นอกจากนี้ Mercure Patong ยังมีสระว่ายน้ำ และบาร์ริมสระว่ายน้ำให้บริการ เพื่อให้การมาเยือนป่าตองของคุณยอดเยี่ยมขึ้นไปอีก นอกจากนี้ ที่พักยังมีที่จอดรถฟรีเพื่อความสะดวกยิ่งขึ้นสำหรับแขก
ด้วยทำเลที่อยู่ใกล้กับสถานที่ท่องเที่ยวยอดนิยม เช่น สนามมวย บางลาป่าตอง (1.3 กม.) และมัสยิดป่าตอง (2.3 กม.) แขกของ Mercure Patong จึงสามารถเยี่ยมชมสถานที่ท่องเที่ยวสำคัญต่างๆ ของป่าตองได้อย่างง่ายดาย
หากคุณชอบร้านอาหารอิตาลี Mercure Patong ตั้งอยู่ใกล้กับร้านลา กริตตา, La Dolce Vita Restaurant และลีโอ & มาส์ ริสโตรอนเต้ อิตาเลียโนเอพิซเซอเรีย
เมื่อเดินทางมาเที่ยวที่นี่ อย่าลืมแวะชมสถานที่ท่องเที่ยวยอดนิยม เช่น หาดป่าตอง (1.1 กม.), ถนนบางลา (0.9 กม.) และสนามมวยป่าตอง (1.7 กม.) ซึ่งต่างก็อยู่ไม่ไกลและสามารถเดินได้จากโรงแรม
เรามั่นใจว่าคุณจะมีความสุขกับการเข้าพักที่ดีวานา พลาซ่า ภูเก็ต ป่าตองขณะที่สัมผัสทุกประสบการณ์อันยอดเยี่ยมของป่าตอง
",7.88564,98.29425,"['https://media-cdn.tripadvisor.com/media/photo-s/0a/6f/9c/57/pool-area.jpg', 'https://media-cdn.tripadvisor.com/media/photo-s/14/2a/66/ab/deevana-plaza-phuket.jpg', 'https://media-cdn.tripadvisor.com/media/oyster-panos/sources/deluxe-pool-view-room--v160664.tiles/wide_700.jpg', 'https://media-cdn.tripadvisor.com/media/photo-s/14/2a/68/8d/deevana-plaza-phuket.jpg', 'https://media-cdn.tripadvisor.com/media/photo-s/12/88/cc/38/deevana-plaza-phuket.jpg', 'https://media-cdn.tripadvisor.com/media/oyster-panos/sources/deluxe-suite-room--v160663.tiles/wide_700.jpg', 'https://media-cdn.tripadvisor.com/media/photo-s/0c/62/ee/75/plaza-i-meeting-room.jpg', 'https://media-cdn.tripadvisor.com/media/photo-s/0b/69/aa/b6/premier-pool-view-room.jpg', 'https://media-cdn.tripadvisor.com/media/oyster-panos/sources/family-room--v160668.tiles/wide_700.jpg', 'https://media-cdn.tripadvisor.com/media/photo-s/12/85/5a/bf/deevana-plaza-phuket.jpg', 'https://media-cdn.tripadvisor.com/media/photo-s/12/85/59/e2/deevana-plaza-phuket.jpg', 'https://media-cdn.tripadvisor.com/media/oyster-panos/sources/premire-room--v160665.tiles/wide_700.jpg', 'https://media-cdn.tripadvisor.com/media/photo-s/06/96/15/3f/deevana-plaza-phuket.jpg', 'https://media-cdn.tripadvisor.com/media/photo-s/08/c3/55/01/deevana-plaza-phuket.jpg', 'https://media-cdn.tripadvisor.com/media/oyster-panos/sources/pool--v160666.tiles/wide_700.jpg']",,https://th.tripadvisor.com/Hotel_Review-g297930-d754312-Reviews-Deevana_Plaza_Phuket_Patong-Patong_Kathu_Phuket.html,4,"['ที่จอดรถฟรี', 'อินเตอร์เน็ตความเร็วสูง (WiFi) ฟรี', 'ฟิตเนสเซนเตอร์พร้อมห้องออกกำลังกาย', 'สระว่ายน้ำ', 'บาร์ / เลานจ์', 'สไลเดอร์น้ำ', 'กิจกรรมสำหรับเด็ก (เป็นมิตรกับเด็กและครอบครัว)', 'สโมสรสำหรับเด็ก', 'ม่านกันแสง', 'เสื้อคลุมอาบน้ำ', 'เครื่องปรับอากาศ', 'โต๊ะทำงาน', 'บริการทำความสะอาด', 'มินิบาร์', 'เคเบิลทีวี / ทีวีดาวเทียม', 'โถชำระล้าง']","['วิวภูเขา', 'วิวเมือง', 'วิวสระว่ายน้ำ', 'ห้องพักปลอดบุหรี่', 'ห้องสวีท', 'ห้องสำหรับครอบครัว']",['โรงแรม'],"239-14 ถนนราษฎร์อุทิศ 200 ปี, ป่าตอง, กะทู้, จังหวัดภูเก็ต 83150 ไทย",ภูเก็ต,กะทู้,,83,8302,0,4,3510
ไดมอนด์ คลิฟ รีสอร์ท แอนด์ สปา,"การมองหารีสอร์ทโรแมนติกที่ใช่ในป่าตองไม่ใช่เรื่องยากอีกต่อไป ยินดีต้อนรับสู่ไดมอนด์ คลิฟ รีสอร์ท แอนด์ สปาตัวเลือกที่น่าสนใจสำหรับนักท่องเที่ยวเช่นคุณ
ห้องพักที่ Diamond Cliff มีทีวีจอแบน เครื่องปรับอากาศ และตู้เย็นและแขกจะไม่พลาดการเชื่อมต่อด้วยบริการ Wifi ฟรี
นอกจากนี้ แขกซึ่งเข้าพักที่ไดมอนด์ คลิฟ รีสอร์ท แอนด์ สปาจะได้รับประโยชน์จากรูมเซอร์วิส และเจ้าหน้าที่อำนวยความสะดวกคุณสามารถใช้บริการสระว่ายน้ำ และอาหารเช้าได้ขณะเข้าพักที่ Diamond Cliff หากคุณต้องการที่จอดรถ Diamond Cliff Hotel มีที่จอดรถฟรีพร้อมให้บริการ
ด้วยทำเลที่อยู่ใกล้กับสถานที่ท่องเที่ยวยอดนิยม เช่น มัสยิดป่าตอง (0.5 กม.) และสนามมวย บางลาป่าตอง (1.5 กม.) แขกของ Diamond Cliff จึงสามารถเยี่ยมชมสถานที่ท่องเที่ยวสำคัญต่างๆ ของป่าตองได้อย่างง่ายดาย
",7.908553,98.29709,"['https://media-cdn.tripadvisor.com/media/photo-s/16/23/22/fd/ocean-jacuzzi-suite-in.jpg', 'https://media-cdn.tripadvisor.com/media/photo-s/16/20/0a/2a/lobby-area.jpg', 'https://media-cdn.tripadvisor.com/media/photo-s/16/20/09/88/hotel-s-main-lobby-building.jpg', 'https://media-cdn.tripadvisor.com/media/photo-s/16/20/0d/98/hotel-s-fruit-shop.jpg', 'https://media-cdn.tripadvisor.com/media/photo-s/16/23/23/7f/ocean-jacuzzi-suite-2.jpg', 'https://media-cdn.tripadvisor.com/media/photo-s/16/20/0f/91/the-sea-bar-lobby-bar.jpg', 'https://media-cdn.tripadvisor.com/media/photo-s/16/20/0b/35/main-entrance.jpg', 'https://media-cdn.tripadvisor.com/media/photo-s/16/23/20/ae/thai-orchid-restaurant.jpg', 'https://media-cdn.tripadvisor.com/media/photo-s/16/20/0b/71/kiko-japanese-restaurant.jpg', 'https://media-cdn.tripadvisor.com/media/photo-s/16/20/0b/d4/kiko-japanese-restaurant.jpg', 'https://media-cdn.tripadvisor.com/media/photo-s/16/23/22/c2/ocean-jacuzzi-suite-king.jpg', 'https://media-cdn.tripadvisor.com/media/photo-s/16/23/21/3b/thai-orchid-restaurant.jpg', 'https://media-cdn.tripadvisor.com/media/photo-s/16/20/0a/59/reception.jpg', 'https://media-cdn.tripadvisor.com/media/photo-s/0c/6e/cd/8d/two-bedroom-pool-villa.jpg', 'https://media-cdn.tripadvisor.com/media/photo-s/12/f6/52/53/villa-2-bedroom.jpg']",,https://th.tripadvisor.com/Hotel_Review-g297930-d305263-Reviews-Diamond_Cliff_Resort_And_Spa-Patong_Kathu_Phuket.html,4,"['ที่จอดรถฟรี', 'อินเตอร์เน็ตความเร็วสูง (WiFi) ฟรี', 'ฟิตเนสเซนเตอร์พร้อมห้องออกกำลังกาย', 'สระว่ายน้ำ', 'บาร์ / เลานจ์', 'บริการดูแลเด็กเล็ก', 'พื้นที่เด็กเล่นภายในร่ม', 'บริการรถรับส่งฟรีหรือแท็กซี่', 'ม่านกันแสง', 'เครื่องปรับอากาศ', 'บริการทำความสะอาด', 'ระเบียงส่วนตัว', 'บริการรูมเซอร์วิส', 'มินิบาร์', 'ทีวีจอแบน', 'ไดร์เป่าผม']","['วิวมหาสมุทร', 'ห้องพักปลอดบุหรี่', 'ห้องสวีท', 'ห้องสำหรับครอบครัว', 'มีห้องพักแบบสูบบุหรี่ได้']",['รีสอร์ท'],"284 ถนนพระบารมี หาดป่าตอง, ป่าตอง, กะทู้, จังหวัดภูเก็ต 83150 ไทย",ภูเก็ต,กะทู้,,83,8302,0,4.5,2111
ซันวิงรีสอร์ทกมลาบีช,"หากคุณกำลังมองหารีสอร์ทเหมาะสำหรับครอบครัวในกมลาแล้วล่ะก็ ลองมาดูซันวิงรีสอร์ทกมลาบีชได้เลย
ระหว่างเข้าพักที่ซันวิงรีสอร์ทกมลาบีชนักท่องเที่ยวสามารถไปเยือนปางช้าง กมลา (0.7 กม.) ซึ่งเป็นสถานที่ท่องเที่ยวยอดนิยมของกมลา
มีบริการ Wifi สำหรับแขก และห้องพักที่ซันวิงรีสอร์ทกมลาบีชนั้นพร้อมไปด้วยทีวีจอแบน เครื่องปรับอากาศ และตู้เย็น
ระหว่างเข้าพักคุณสามารถใช้ประโยชน์จากบริการและสิ่งอำนวยความสะดวก เช่น เจ้าหน้าที่อำนวยความสะดวก และรูมเซอร์วิส ซันวิงรีสอร์ทกมลาบีชมีสระว่ายน้ำ และบาร์ริมสระว่ายน้ำภายในสถานที่ให้บริการกับแขกที่เข้าพัก สำหรับนักท่องเที่ยวที่ขับรถมา ที่พักแห่งนี้มีที่จอดรถฟรี
ระหว่างที่มาเยือน ลองแวะไปที่ร้านกุ้งมังกรยอดนิยมของกมลา เช่น Restaurant at Lillo Island Resort, Plum Prime Steakhouse และ Smile Bar ซึ่งต่างก็อยู่ไม่ไกลจาก Sunwing Resort - Kamala Beach Hotel
หากคุณกำลังมองหากิจกรรมน่าสนใจสวนอนุสรณ์สึนามิถือเป็นตัวเลือกที่ไม่ควรมองข้าม
พนักงานของซันวิงรีสอร์ทกมลาบีชพร้อมแล้วที่จะให้บริการคุณในทริปต่อไป
",7.952033,98.28442,"['https://media-cdn.tripadvisor.com/media/photo-s/1a/eb/6d/3f/sunwing-kamala-beach.jpg', 'https://media-cdn.tripadvisor.com/media/photo-s/1a/eb/6e/b7/sunwing-kamala-beach.jpg', 'https://media-cdn.tripadvisor.com/media/photo-s/1a/eb/75/eb/sunwing-kamala-beach.jpg', 'https://media-cdn.tripadvisor.com/media/photo-s/1a/eb/74/d2/sunwing-kamala-beach.jpg', 'https://media-cdn.tripadvisor.com/media/photo-s/1a/f2/8a/73/family-suite.jpg', 'https://media-cdn.tripadvisor.com/media/photo-s/15/b7/bb/b6/playground.jpg', 'https://media-cdn.tripadvisor.com/media/photo-s/15/b7/bc/4f/beach.jpg', 'https://media-cdn.tripadvisor.com/media/photo-s/15/b7/bb/e1/gym.jpg', 'https://media-cdn.tripadvisor.com/media/photo-s/15/b7/bb/b3/playground.jpg', 'https://media-cdn.tripadvisor.com/media/photo-s/15/b7/bc/34/beach.jpg', 'https://media-cdn.tripadvisor.com/media/photo-s/15/b7/bb/a5/mascot-lollo-bernie.jpg', 'https://media-cdn.tripadvisor.com/media/photo-s/15/b7/bb/e8/aqua-aerobic.jpg', 'https://media-cdn.tripadvisor.com/media/photo-s/15/b7/bc/4a/beach.jpg', 'https://media-cdn.tripadvisor.com/media/photo-s/15/b7/bc/11/minimarket.jpg', 'https://media-cdn.tripadvisor.com/media/photo-s/15/b7/c3/92/fino-restaurant.jpg']",00 66 76 371 650,https://th.tripadvisor.com/Hotel_Review-g1379324-d1593178-Reviews-Sunwing_Kamala_Beach-Kamala_Kathu_Phuket.html,4,"['ที่จอดรถฟรี', 'อินเทอร์เน็ตฟรี', 'ฟิตเนสเซนเตอร์พร้อมห้องออกกำลังกาย', 'สระว่ายน้ำ', 'บาร์ / เลานจ์', 'ชายหาด', 'แบดมินตัน', 'เด็กเข้าพักฟรี', 'เสื้อคลุมอาบน้ำ', 'เครื่องปรับอากาศ', 'บริการทำความสะอาด', 'ระเบียงส่วนตัว', 'เครื่องชงกาแฟ / ชา', 'เคเบิลทีวี / ทีวีดาวเทียม', 'โซฟาเบด', 'โถชำระล้าง']","['วิวภูเขา', 'วิวมหาสมุทร', 'วิวสระว่ายน้ำ', 'ห้องพักปลอดบุหรี่', 'ห้องสวีท', 'ห้องสำหรับครอบครัว']",['รีสอร์ท'],"96/66 หมู่ 3 หาดกมลา, กมลา, กะทู้, จังหวัดภูเก็ต 83150 ไทย",ภูเก็ต,กะทู้,,83,8302,0,4,1217
เดอะ ลูน่าโฮสเทล,,8.101054,98.30613,"['https://media-cdn.tripadvisor.com/media/photo-s/12/d5/74/a0/caption.jpg', 'https://media-cdn.tripadvisor.com/media/photo-s/28/b0/91/2e/caption.jpg', 'https://media-cdn.tripadvisor.com/media/photo-s/13/10/24/4c/photo4jpg.jpg', 'https://media-cdn.tripadvisor.com/media/photo-s/0e/45/5c/4f/nice-hostel.jpg', 'https://media-cdn.tripadvisor.com/media/photo-s/0e/48/74/31/caption.jpg', 'https://media-cdn.tripadvisor.com/media/photo-s/17/97/25/b5/img-20190520-083813-largejpg.jpg', 'https://media-cdn.tripadvisor.com/media/photo-s/16/b8/49/1a/photo1jpg.jpg', 'https://media-cdn.tripadvisor.com/media/photo-s/17/97/25/b6/img-20190520-085633-largejpg.jpg', 'https://media-cdn.tripadvisor.com/media/photo-s/0e/ba/2f/d3/photo4jpg.jpg', 'https://media-cdn.tripadvisor.com/media/photo-s/13/10/24/49/photo1jpg.jpg', 'https://media-cdn.tripadvisor.com/media/photo-s/0f/15/53/eb/the-luna-hostel.jpg', 'https://media-cdn.tripadvisor.com/media/photo-s/0f/15/54/a6/the-luna-hostel.jpg', 'https://media-cdn.tripadvisor.com/media/photo-s/0e/41/9a/50/the-luna-hostel.jpg', 'https://media-cdn.tripadvisor.com/media/photo-s/13/10/24/48/photo0jpg.jpg', 'https://media-cdn.tripadvisor.com/media/photo-s/13/10/24/4a/photo2jpg.jpg']",,https://th.tripadvisor.com/Hotel_Review-g2315813-d12062141-Reviews-The_Luna_Hostel-Sakhu_Thalang_District_Phuket.html,2,"['ที่จอดรถฟรี', 'อินเตอร์เน็ตความเร็วสูง (WiFi) ฟรี', 'สระว่ายน้ำ', 'อาหารเช้าฟรี', 'มีบริการจักรยาน', 'กิจกรรมสำหรับเด็ก (เป็นมิตรกับเด็กและครอบครัว)', 'บริการเช่ารถ', 'บริการนวด', 'เครื่องปรับอากาศ', 'บริการทำความสะอาด', 'ครัวขนาดเล็ก']",['ห้องพักปลอดบุหรี่'],['โฮสเทล'],"19/09 ซอยในยาง 16 หาดในยาง, สาคู, จังหวัดภูเก็ต 83110 ไทย",ภูเก็ต,ถลาง,,83,8303,0,5,100
