name,description,latitude,longitude,imgPath,phone,website,star,facility,tag,type,address,province,district,subDistrict,province_code,district_code,sub_district_code,score,ratingCount
อนันตรา เวเคชั่น คลับ ไม้ขาว ภูเก็ต,"หากคุณกำลังมองหารีสอร์ทเหมาะสำหรับครอบครัวในไม้ขาวแล้วล่ะก็ ลองมาดูอนันตรา เวเคชั่น คลับ ไม้ขาว ภูเก็ตได้เลย
สะพานสารสิน (3.7 กม.) ตั้งอยู่ใกล้กับอนันตรา เวเคชั่น คลับ ไม้ขาว ภูเก็ตทำให้ที่พักแห่งนี้เป็นตัวเลือกที่ยอดเยี่ยมสำหรับนักท่องเที่ยวที่ต้องการไปเยือนสถานที่ท่องเที่ยวยอดนิยมของไม้ขาวแห่งนี้
ห้องพักที่อนันตรา เวเคชั่น คลับ ไม้ขาว ภูเก็ตมีทีวีจอแบน และครัวขนาดเล็กเพื่อความสะดวกสบายระหว่างเข้าพัก และแขกยังสามารถเชื่อมต่ออินเทอร์เน็ตได้ด้วยบริการ Wifi ฟรี
รูมเซอร์วิส และเจ้าหน้าที่อำนวยความสะดวกเป็นส่วนหนึ่งของบริการที่รีสอร์ทแห่งนี้ สระว่ายน้ำ และอาหารเช้าจะช่วยให้การเข้าพักของคุณพิเศษขึ้นไปอีก หากคุณวางแผนที่จะขับรถมาอนันตรา เวเคชั่น คลับ ไม้ขาว ภูเก็ตยังมีที่จอดรถฟรีพร้อมให้บริการ
",8.165281,98.29603,"['https://media-cdn.tripadvisor.com/media/photo-s/1c/dd/0e/f1/divi-in-movie.jpg', 'https://media-cdn.tripadvisor.com/media/photo-s/1a/72/ed/91/anantara-vacation-club.jpg', 'https://media-cdn.tripadvisor.com/media/photo-s/22/fa/d7/38/anantara-vacation-club.jpg', 'https://media-cdn.tripadvisor.com/media/photo-s/22/fa/d5/eb/anantara-vacation-club.jpg', 'https://media-cdn.tripadvisor.com/media/photo-s/22/fa/d6/21/anantara-vacation-club.jpg', 'https://media-cdn.tripadvisor.com/media/photo-s/0c/c8/41/cd/kid-pizza.jpg', 'https://media-cdn.tripadvisor.com/media/photo-s/23/4d/d1/16/anantara-vacation-club.jpg', 'https://media-cdn.tripadvisor.com/media/photo-s/23/4d/d1/43/anantara-vacation-club.jpg', 'https://media-cdn.tripadvisor.com/media/photo-o/0c/c8/42/c8/resort-bike-tour.jpg', 'https://media-cdn.tripadvisor.com/media/photo-s/0c/c8/46/9f/phuket-old-town.jpg', 'https://media-cdn.tripadvisor.com/media/photo-s/07/c9/ba/cf/anantara-vacation-club.jpg', 'https://media-cdn.tripadvisor.com/media/photo-p/07/c9/bc/ff/anantara-vacation-club.jpg', 'https://media-cdn.tripadvisor.com/media/photo-s/07/c9/ba/99/anantara-vacation-club.jpg', 'https://media-cdn.tripadvisor.com/media/photo-s/0c/c8/2d/fb/meet-the-jakka.jpg', 'https://media-cdn.tripadvisor.com/media/photo-s/0c/c8/42/cb/shopping.jpg']",,https://th.tripadvisor.com/Hotel_Review-g1223683-d4302438-Reviews-Anantara_Vacation_Club_Mai_Khao_Phuket-Mai_Khao_Thalang_District_Phuket.html,5,"['ที่จอดรถฟรี', 'อินเตอร์เน็ตความเร็วสูง (WiFi) ฟรี', 'ฟิตเนสเซนเตอร์พร้อมห้องออกกำลังกาย', 'สระว่ายน้ำ', 'บาร์ / เลานจ์', 'บริการให้เช่าจักรยาน', 'มีบริการจักรยาน', 'เด็กเข้าพักฟรี', 'ม่านกันแสง', 'เสื้อคลุมอาบน้ำ', 'ห้องน้ำเพิ่มเติม', 'ระเบียงส่วนตัว', 'บริการรูมเซอร์วิส', 'ปลอดภัย', 'ครัวขนาดเล็ก', 'ทีวีจอแบน']",['ห้องสวีท'],['รีสอร์ท'],"239-239/1 หมู่ 3, ไม้ขาว, จังหวัดภูเก็ต 83110 ไทย",ภูเก็ต,ถลาง,,83,8303,0,4.5,1421
Hotel IKON Phuket,"Hotel IKON Phuket เป็นตัวเลือกที่ยอดเยี่ยมเมื่อมาเยือนกะรนที่พักแห่งนี้มอบส่วนผสมที่ลงตัวทั้งความคุ้มค่าและความสะดวกสบายพร้อมทั้งบรรยากาศเหมาะสำหรับครอบครัว รวมถึงสิ่งอำนวยความสะดวกอันหลากหลายที่ได้รับการออกแบบมาเพื่อนักท่องเที่ยวเช่นคุณ
ห้องพักมีสิ่งอำนวยความสะดวก เช่น ทีวีจอแบน และเครื่องปรับอากาศ และแขกยังสามารถเชื่อมต่ออินเทอร์เน็ตได้ด้วยบริการ Wifi ฟรีของโรงแรม
โรงแรมแห่งนี้มีรูมเซอร์วิส และเจ้าหน้าที่อำนวยความสะดวก เพื่อให้การเข้าพักของคุณสะดวกสบายมากยิ่งขึ้น สถานที่ให้บริการแห่งนี้ยังมีบริการสระว่ายน้ำ และอาหารเช้าฟรีช่วยให้การเข้าพักของคุณยอดเยี่ยมขึ้นไปอีก แขกที่นำรถมาสามารถใช้ที่จอดรถฟรีได้
วัดสุวรรณคีรีเขต (0.8 กม.) ตั้งอยู่ใกล้กับ Hotel IKON Phuket ทำให้ที่พักแห่งนี้เป็นตัวเลือกที่ยอดเยี่ยมสำหรับนักท่องเที่ยวที่ต้องการไปเยือนสถานที่ท่องเที่ยวยอดนิยมของกะรนแห่งนี้
เมื่ออยู่ที่กะรน คุณควรหาโอกาสแวะไปที่ร้านอาหารใกล้ๆ กับ Hotel IKON Phuket เช่น ผัดไท ช็อป (1.3 กม.), Two Chefs - Karon Beach (1.1 กม.) และ Red Onion (1.7 กม.)
มองหาสถานที่ท่องเที่ยวในกะรนอยู่ใช่ไหมจุดชมวิวสามอ่าว (จุดชมวิวกะรน) (1.4 กม.) เป็นสถานที่ท่องเที่ยวยอดนิยมที่สามารถเดินได้จาก Hotel IKON Phuket
เรามั่นใจว่าคุณจะมีความสุขกับการเข้าพักที่ Hotel IKON Phuket ขณะที่สัมผัสทุกประสบการณ์อันยอดเยี่ยมของกะรน
",7.843122,98.30275,"['https://media-cdn.tripadvisor.com/media/photo-s/16/e1/13/cb/hotel-ikon-phuket.jpg', 'https://media-cdn.tripadvisor.com/media/photo-s/16/e1/1c/a1/hotel-ikon-phuket.jpg', 'https://media-cdn.tripadvisor.com/media/oyster-panos/sources/ikon-ocean-primier--v392303.tiles/wide_700.jpg', 'https://media-cdn.tripadvisor.com/media/photo-s/16/e1/1c/8e/hotel-ikon-phuket.jpg', 'https://media-cdn.tripadvisor.com/media/photo-s/16/e1/1c/99/hotel-ikon-phuket.jpg', 'https://media-cdn.tripadvisor.com/media/oyster-panos/sources/ikon-ocean-primier--v392308.tiles/wide_700.jpg', 'https://media-cdn.tripadvisor.com/media/photo-o/16/e1/13/e1/hotel-ikon-phuket.jpg', 'https://media-cdn.tripadvisor.com/media/photo-s/16/e1/14/91/hotel-ikon-phuket.jpg', 'https://media-cdn.tripadvisor.com/media/oyster-panos/sources/ikon-ocean-primier--v392320.tiles/wide_700.jpg', 'https://media-cdn.tripadvisor.com/media/photo-s/16/e1/16/a9/hotel-ikon-phuket.jpg', 'https://media-cdn.tripadvisor.com/media/photo-s/16/e1/13/bf/hotel-ikon-phuket.jpg', 'https://media-cdn.tripadvisor.com/media/oyster-panos/sources/ikon-ocean-primier--v392325.tiles/wide_700.jpg', 'https://media-cdn.tripadvisor.com/media/photo-s/16/e1/1c/57/hotel-ikon-phuket.jpg', 'https://media-cdn.tripadvisor.com/media/photo-s/16/e1/1a/24/hotel-ikon-phuket.jpg', 'https://media-cdn.tripadvisor.com/media/oyster-panos/sources/ikon-superior--v392305.tiles/wide_700.jpg']",,https://th.tripadvisor.com/Hotel_Review-g1215780-d8709982-Reviews-Hotel_IKON_Phuket-Karon_Phuket.html,4,"['ที่จอดรถฟรี', 'อินเตอร์เน็ตความเร็วสูง (WiFi) ฟรี', 'ฟิตเนสเซนเตอร์พร้อมห้องออกกำลังกาย', 'สระว่ายน้ำ', 'อาหารเช้าฟรี', 'บริการรถรับ-ส่งสนามบิน', 'สปา', 'การรักษาความปลอดภัยตลอด 24 ชั่วโมง', 'เครื่องปรับอากาศ', 'ระเบียงส่วนตัว', 'บริการรูมเซอร์วิส', 'ปลอดภัย', 'ตู้เย็น', 'ทีวีจอแบน']","['วิวมหาสมุทร', 'ห้องพักปลอดบุหรี่', 'ห้องสวีท']",['โรงแรม'],"400/2 Patak Road, กะรน, จังหวัดภูเก็ต 83100 ไทย",ภูเก็ต,เมืองภูเก็ต,,83,8301,0,4.5,677
ดุสิตธานี ลากูน่า รีสอร์ท,"ดุสิตธานี ลากูน่า รีสอร์ทเป็นตัวเลือกที่ยอดเยี่ยมเมื่อมาเยือนเชิงทะเล ที่พักแห่งนี้มอบส่วนผสมที่ลงตัวทั้งความคุ้มค่าและความสะดวกสบาย พร้อมทั้งบรรยากาศเหมาะสำหรับครอบครัวรวมถึงสิ่งอำนวยความสะดวกอันหลากหลายที่ได้รับการออกแบบมาเพื่อนักท่องเที่ยวเช่นคุณในฐานะ “บ้านหลังที่สองของคุณ” รีสอร์ทแห่งนี้มีห้องพักพร้อมทีวีจอแบน ตู้เย็น และเครื่องปรับอากาศ และการเชื่อมต่ออินเทอร์เน็ตยังทำได้ง่ายๆ ด้วยบริการ Wifi ฟรี
แขกจะได้รับประโยชน์จากเจ้าหน้าที่อำนวยความสะดวก และรูมเซอร์วิสขณะเข้าพักที่ Dusit Phuket นอกจากนี้ Dusit Thani Laguna Phuket Hotel ยังมีสระว่ายน้ำ และอาหารเช้าฟรีให้บริการ เพื่อให้การมาเยือนเชิงทะเล ของคุณยอดเยี่ยมขึ้นไปอีก นอกจากนี้ ที่พักยังมีที่จอดรถฟรีเพื่อความสะดวกยิ่งขึ้นสำหรับแขก
นักท่องเที่ยวที่อยากทานเบอร์ริโตสามารถมุ่งไปที่ Mamasita Mexican หรือ The Mexican ได้เลย หรือหากคุณต้องการลองอาหารเม็กซิกันลองไปที่ Mamasita Mexican หรือ The Mexican
เชิงทะเล ขึ้นชื่อด้านหอศิลป์รวมถึงเอฟอีทู เดคอร์ และนภัสอาร์ทแกลเลอรี่ซึ่งไม่ไกลจาก Phuket Dusit
ที่ดุสิตธานี ลากูน่า รีสอร์ทความสะดวกสบายและความพอใจของคุณมีความสำคัญเป็นอันดับหนึ่ง ที่พักแห่งนี้รอต้อนรับคุณสู่เชิงทะเล
",8.001707,98.29371,"['https://media-cdn.tripadvisor.com/media/photo-s/11/f4/c6/0a/dusit-thani-laguna-phuket.jpg', 'https://media-cdn.tripadvisor.com/media/photo-s/11/f4/c7/92/dusit-thani-laguna-phuket.jpg', 'https://media-cdn.tripadvisor.com/media/photo-s/11/f4/c7/af/dusit-thani-laguna-phuket.jpg', 'https://media-cdn.tripadvisor.com/media/photo-s/11/f4/c9/e1/dusit-thani-laguna-phuket.jpg', 'https://media-cdn.tripadvisor.com/media/photo-s/11/f4/c8/9a/dusit-thani-laguna-phuket.jpg', 'https://media-cdn.tripadvisor.com/media/photo-s/11/f4/c5/f5/dusit-thani-laguna-phuket.jpg', 'https://media-cdn.tripadvisor.com/media/photo-s/11/f4/c9/a0/dusit-thani-laguna-phuket.jpg', 'https://media-cdn.tripadvisor.com/media/photo-s/11/f4/c9/3c/dusit-thani-laguna-phuket.jpg', 'https://media-cdn.tripadvisor.com/media/photo-s/11/f4/c7/f6/dusit-thani-laguna-phuket.jpg', 'https://media-cdn.tripadvisor.com/media/photo-s/13/35/ef/12/dusit-thani-laguna-phuket.jpg', 'https://media-cdn.tripadvisor.com/media/photo-s/04/69/25/60/dusit-thani-laguna-phuket.jpg', 'https://media-cdn.tripadvisor.com/media/photo-s/11/f4/bf/8e/ruen-thai-restaurant.jpg', 'https://media-cdn.tripadvisor.com/media/photo-s/11/f4/be/60/la-trattoria.jpg', 'https://media-cdn.tripadvisor.com/media/photo-p/11/f4/c0/25/ruen-thai-restaurant.jpg', 'https://media-cdn.tripadvisor.com/media/photo-s/11/f4/bd/96/casuarina-beach-restaurant.jpg']",+66 76 362 999,https://th.tripadvisor.com/Hotel_Review-g1224250-d301365-Reviews-Dusit_Thani_Laguna_Phuket-Choeng_Thale_Thalang_District_Phuket.html,5,"['ที่จอดรถฟรี', 'อินเตอร์เน็ตความเร็วสูง (WiFi) ฟรี', 'ฟิตเนสเซนเตอร์พร้อมห้องออกกำลังกาย', 'สระว่ายน้ำ', 'อาหารเช้าฟรี', 'ชายหาด', 'สนามเทนนิส', 'เด็กเข้าพักฟรี', 'เสื้อคลุมอาบน้ำ', 'เครื่องปรับอากาศ', 'บริการทำความสะอาด', 'ระเบียงส่วนตัว', 'บริการรูมเซอร์วิส', 'มินิบาร์', 'ตู้เย็น', 'ทีวีจอแบน']","['วิวมหาสมุทร', 'ห้องสวีทสำหรับคู่แต่งงาน', 'ห้องพักปลอดบุหรี่', 'ห้องสวีท', 'ห้องสำหรับครอบครัว', 'มีห้องพักแบบสูบบุหรี่ได้']",['รีสอร์ท'],"390 หมู่ 1 ถ. ศรึสุนทร, เชิงทะเล , จังหวัดภูเก็ต 83110 ไทย",ภูเก็ต,ถลาง,,83,8303,0,4.5,2911
อันดารา รีสอร์ท แอนด์ วิลล่า,"เมื่อเที่ยวเต็มที่แล้ว ใครๆ ก็ต้องการที่นอนพักให้หายเหนื่อยซักหน่อย สำหรับนักท่องเที่ยวที่มาเยือนกมลาแล้ว อันดารา รีสอร์ท แอนด์ วิลล่าเป็นตัวเลือกที่ยอดเยี่ยมสำหรับพักผ่อนและชาร์จพลัง ที่พักแห่งนี้ขึ้นชื่อด้านบรรยากาศเหมาะสำหรับครอบครัว รวมทั้งทำเลที่ยอดเยี่ยมใกล้ร้านอาหารอร่อยๆอันดารา รีสอร์ท แอนด์ วิลล่าทำให้การสำรวจสิ่งที่ดีที่สุดของกมลาเป็นเรื่องง่าย
ห้องพักมีทีวีจอแบน ตู้เย็น และครัวขนาดเล็ก และ Andara Resort And Villas Hotel ยังทำให้การเชื่อมต่ออินเทอร์เน็ตเป็นเรื่องง่ายด้วยบริการ Wifi ฟรี
คุณสามารถใช้ประโยชน์จากบริการและสิ่งอำนวยความสะดวกของ Andara Resort And Villas Hotel เช่น สระว่ายน้ำบนดาดฟ้า รูมเซอร์วิส และเจ้าหน้าที่อำนวยความสะดวก นอกจากนี้ แขกยังสามารถเพลิดเพลินไปกับสระว่ายน้ำ และอาหารเช้าฟรีระหว่างการเข้าพัก เพื่อเพิ่มความสะดวกขึ้นไปอีกขั้น ที่พักมีที่จอดรถฟรีสำหรับแขกอีกด้วย
ระหว่างเข้าพักที่ Andara Resort And Villas Hotel นักท่องเที่ยวสามารถไปเยือนปางช้าง กมลา (0.6 กม.) ซึ่งเป็นสถานที่ท่องเที่ยวยอดนิยมของกมลา
เมื่อคุณมาถึงแล้ว อย่าลืมแวะไปที่ร้านอาหารฝรั่งเศสอย่าง Lafayette French Bakery, บ้านใหม่ และ Cocorico kamala phuket ซึ่งต่างก็อยู่ไม่ไกลจากอันดารา รีสอร์ท แอนด์ วิลล่า
หากคุณกำลังมองหากิจกรรมน่าสนใจ ลองดูสวนอนุสรณ์สึนามิซึ่งเป็นอนุสาวรีย์ที่ได้รับความนิยมในหมู่นักท่องเที่ยว
Andara Resort And Villas Hotel จะช่วยให้การมาเยือนกมลาของคุณเป็นที่น่าจดจำอย่างแน่นอน
",7.949542,98.274994,"['https://media-cdn.tripadvisor.com/media/photo-s/19/ee/f1/43/andara-resort-and-villas.jpg', 'https://media-cdn.tripadvisor.com/media/oyster/500/06/7c/39/3f/pool--v3105598.jpg', 'https://media-cdn.tripadvisor.com/media/photo-s/19/ee/f0/ec/andara-resort-and-villas.jpg', 'https://media-cdn.tripadvisor.com/media/photo-s/19/ee/d1/a7/andara-resort-and-villas.jpg', 'https://media-cdn.tripadvisor.com/media/photo-s/19/ee/f1/35/andara-resort-and-villas.jpg', 'https://media-cdn.tripadvisor.com/media/photo-s/01/8c/ec/cf/andara-yachts.jpg', 'https://media-cdn.tripadvisor.com/media/photo-s/02/5b/ce/1f/pool-villa.jpg', 'https://media-cdn.tripadvisor.com/media/photo-s/29/25/89/0c/andara-resort-and-villas.jpg', 'https://media-cdn.tripadvisor.com/media/photo-s/29/25/88/c7/andara-resort-and-villas.jpg', 'https://media-cdn.tripadvisor.com/media/photo-s/29/25/88/ac/andara-resort-and-villas.jpg', 'https://media-cdn.tripadvisor.com/media/photo-s/01/78/e8/d3/andara-spa.jpg', 'https://media-cdn.tripadvisor.com/media/photo-s/1d/75/79/89/andara-resort-and-villas.jpg', 'https://media-cdn.tripadvisor.com/media/photo-s/19/ee/f1/19/andara-resort-and-villas.jpg', 'https://media-cdn.tripadvisor.com/media/photo-s/29/25/89/c2/large-bathroom-with-bathtub.jpg', 'https://media-cdn.tripadvisor.com/media/photo-s/29/25/88/da/andara-resort-and-villas.jpg']",00 66 76 338 777,https://th.tripadvisor.com/Hotel_Review-g1379324-d1370724-Reviews-Andara_Resort_and_Villas-Kamala_Kathu_Phuket.html,5,"['ที่จอดรถฟรี', 'อินเตอร์เน็ตความเร็วสูง (WiFi) ฟรี', 'ฟิตเนสเซนเตอร์พร้อมห้องออกกำลังกาย', 'สระว่ายน้ำ', 'อาหารเช้าฟรี', 'เรือ', 'การดำน้ำ', 'บริการดูแลเด็กเล็ก', 'ม่านกันแสง', 'เสื้อคลุมอาบน้ำ', 'เครื่องปรับอากาศ', 'ห้องน้ำเพิ่มเติม', 'โต๊ะทำงาน', 'เครื่องชงกาแฟ / ชา', 'เคเบิลทีวี / ทีวีดาวเทียม', 'โถชำระล้าง']","['วิวมหาสมุทร', 'วิวสระว่ายน้ำ', 'ห้องพักปลอดบุหรี่', 'ห้องสวีท', 'ห้องสำหรับครอบครัว']",['รีสอร์ท'],"15 หมู่ 6, กมลา, กะทู้, จังหวัดภูเก็ต 83150 ไทย",ภูเก็ต,กะทู้,,83,8302,0,5,769
Harmony Naturist Resort Rawai Phuket Thailand,,7.765774,98.31055,"['https://media-cdn.tripadvisor.com/media/photo-s/21/67/08/4f/your-hosts.jpg', 'https://media-cdn.tripadvisor.com/media/photo-s/27/7e/29/d1/harmony-naturist-resort.jpg', 'https://media-cdn.tripadvisor.com/media/photo-s/27/7e/29/89/harmony-naturist-resort.jpg', 'https://media-cdn.tripadvisor.com/media/photo-s/27/7e/29/74/harmony-naturist-resort.jpg', 'https://media-cdn.tripadvisor.com/media/photo-s/27/7e/29/72/harmony-naturist-resort.jpg', 'https://media-cdn.tripadvisor.com/media/photo-s/27/7e/29/ce/harmony-naturist-resort.jpg', 'https://media-cdn.tripadvisor.com/media/photo-s/27/7e/29/cd/harmony-naturist-resort.jpg', 'https://media-cdn.tripadvisor.com/media/photo-s/27/7e/29/c8/harmony-naturist-resort.jpg', 'https://media-cdn.tripadvisor.com/media/photo-s/27/7e/29/c7/harmony-naturist-resort.jpg', 'https://media-cdn.tripadvisor.com/media/photo-s/27/7e/29/c5/harmony-naturist-resort.jpg', 'https://media-cdn.tripadvisor.com/media/photo-s/27/7e/29/c4/harmony-naturist-resort.jpg', 'https://media-cdn.tripadvisor.com/media/photo-s/27/7e/29/c3/harmony-naturist-resort.jpg', 'https://media-cdn.tripadvisor.com/media/photo-s/27/7e/29/c2/harmony-naturist-resort.jpg', 'https://media-cdn.tripadvisor.com/media/photo-s/27/7e/29/c1/harmony-naturist-resort.jpg', 'https://media-cdn.tripadvisor.com/media/photo-s/27/7e/29/be/harmony-naturist-resort.jpg']",,https://th.tripadvisor.com/Hotel_Review-g297934-d19243778-Reviews-Harmony_Naturist_Resort_Rawai_Phuket_Thailand-Rawai_Phuket.html,3,"['ที่จอดรถฟรี', 'อินเตอร์เน็ตความเร็วสูง (WiFi) ฟรี', 'ชั้นเรียนโยคะ', 'สระว่ายน้ำ', 'อาหารเช้าฟรี', 'บริการให้เช่าจักรยาน', 'เรือ', 'บริการรถรับ-ส่งสนามบิน', 'เครื่องปรับอากาศ', 'โต๊ะทำงาน', 'บริการทำความสะอาด', 'ระเบียงส่วนตัว', 'เครื่องชงกาแฟ / ชา', 'เคเบิลทีวี / ทีวีดาวเทียม', 'โซฟาเบด', 'ห้องอาบน้ำแบบฝักบัว']","['วิวสระว่ายน้ำ', 'ห้องพักปลอดบุหรี่']",['ไม่รู้จัก'],"96/5 หมู่ 6, ราไวย์, จังหวัดภูเก็ต 83130 ไทย",ภูเก็ต,เมืองภูเก็ต,,83,8301,0,5,120
